"place","coords","created_at","possibly_sensitive","retweet_count","reply_count","like_count","quote_count","text","sentiment"
"","","2022-04-20 07:08:55+00:00","False","0","1","0","0","driver history successful saturday lewis hamilton race entries lewis qualified pole times also taken pole position every season competed ridiculous ask","positive"
"","","2022-04-20 07:07:44+00:00","False","0","0","1","0","imagine man united lewis hamilton fananfield done next imola italian gp","positive"
"","","2022-04-20 07:07:16+00:00","False","0","1","0","0","basically rite passage lewis hamilton one greatest ever drive wettalking wet weather skill brings mind silverstone lewis hamiltons drive torrential rains hailed many greatest wet weather drive time","positive"
"","","2022-04-20 07:06:25+00:00","False","0","0","28","0","years ago today lewis hamilton chinese grand prix","neutral"
"","","2022-04-20 07:02:26+00:00","False","0","1","0","0","despite incredible achievement still doubt among whether belongs likes schumacher fangio sennawhat going outline reasons believe lewis hamilton greatest driver time","positive"
"","","2022-04-20 07:01:15+00:00","False","0","1","0","0","whyis goat lewishamilton threadlast time barcelona lewis hamilton became first driver reach pole positions formula poles ahead michael schumacher second place","positive"
"","","2022-04-20 06:53:05+00:00","False","0","0","0","0","livery livery fraudulent corrupt fia michael masi stole championship lewis hamilton","negative"
"","","2022-04-20 06:51:10+00:00","False","0","0","0","0","topps chrome formula lewis hamilton mercedes refractor ebay tradingcards sportstradingcards","neutral"
"","","2022-04-20 06:50:53+00:00","False","0","0","0","0","latest news charles leclerc sir lewis hamilton daniel ricciardo kevin magnussen itc racingvia","neutral"
"","","2022-04-20 06:50:19+00:00","False","0","0","0","0","lewis hamilton tipped challenge wins matter weeks save season sport","neutral"
"","","2022-04-20 06:24:01+00:00","False","0","3","17","1","watching final drive survive episode hamilton final race wonin golfing terms dormie suddenly rules official said next hole decided match lewis put tee shot hazard","neutral"
"","","2022-04-20 06:21:51+00:00","False","6","24","21","0","creating lewis hamilton fan gc","neutral"
"","","2022-04-20 06:20:46+00:00","False","0","7","29","0","spending years throwing hot takes enjoy life nowadays greater wisdom serenityso today april th want say lewis hamilton fuckin robbed abu dhabi last year","negative"
"","","2022-04-20 06:17:12+00:00","False","0","0","0","0","lewis hamilton odds downbeat toto wolffs recent title comments","negative"
"","","2022-04-20 06:06:06+00:00","False","0","1","0","0","butwiper like lewis hamilton fans need whipe ass tears drove hard fair got ripped merc masi multipple times biassed blind fans accept sulky sir beaten abd new era come basket","negative"
"","","2022-04-20 05:46:49+00:00","False","0","0","0","0","apple mac repairs support info mall africa flop season basotho ndlozi pimville lira vaal daily sun manchesterunited nhlanhlalux mane lewis hamilton elvis nyathi kznfloods koko bailly eswatini south africans apartheid happy","neutral"
"","","2022-04-20 05:35:03+00:00","False","0","1","1","0","like taking risks like trying new things whether style restaurants whatever lewis hamilton formula lewishamilton","positive"
"","","2022-04-20 05:34:06+00:00","False","0","0","0","0","lewis hamilton schumacher ready seat yet","negative"
"","","2022-04-20 05:31:05+00:00","False","0","0","1","0","quite sad thing twitter wants remember imolagp george russell vs bottas tiff easily forget lewis hamilton veered track reversed gravel still took","negative"
"","","2022-04-20 05:10:41+00:00","False","0","1","6","0","ranbir kapoor busy work released movie since btw yearsdonald trump lost modji lewis hamilton titles chelsea ucl leo messi left barca yeh bhaisaab ek movie na bana paaye  kya working hai","negative"
"","","2022-04-20 05:10:21+00:00","False","0","2","0","0","cant wait see lewis hamilton pull masterclass wheelbarrowin wetsor","positive"
"","","2022-04-20 04:55:02+00:00","False","0","2","0","0","saying thewho admitted human error made lewis hamilton fans mean really hard say lewis fans humanerrorchampion","negative"
"","","2022-04-20 04:40:18+00:00","False","0","1","1","0","honestly dont think would ever happen bcuz ferrari doesnt give drivers kind freedom lewis needs thrive didnt allow leclerc fashion line teams decline participation hamilton commission","negative"
"","","2022-04-20 04:34:31+00:00","False","0","0","1","0","gonna credit lewis two maxs failures hamilton fans suck dick","negative"
"","","2022-04-20 04:33:47+00:00","False","0","0","9","0","lewis hamilton finished cship position races max verstappen finished cship position pts ahead","neutral"
"","","2022-04-20 04:24:30+00:00","False","0","1","0","0","verstappen went combat lewis hamilton ricciardo better driver day faster one","neutral"
"","","2022-04-20 04:21:10+00:00","False","0","0","0","0","andle bolela ka nosilena ke yona tendency stinging legally sa think would nice secure lewis hamilton interview put end speculation powerup powerbreakfast","neutral"
"","","2022-04-20 04:21:09+00:00","False","2","1","15","0","well better lewis hamilton","positive"
"","","2022-04-20 04:05:22+00:00","False","0","0","0","0","emilia romagna gp charles leclerc eyes title push lewis hamilton max verstappen demandmore","neutral"
"","","2022-04-20 03:59:07+00:00","False","0","0","0","0","want rock jaduava new lewis hamilton pro black hoverboard","positive"
"","","2022-04-20 03:50:36+00:00","False","0","2","1","0","ferrari try put hamilton sainzs car next yrlewis frustrated mercedes lack pace exercise exit clauseleclerc win title next year lewis feuding ferrari leaving door open verstappen win nd title","neutral"
"","","2022-04-20 03:08:04+00:00","False","0","0","2","0","alternate universe im transgender lewis hamilton","neutral"
"","","2022-04-20 03:00:02+00:00","False","0","1","2","0","lewis hamilton cling anything might give hope","neutral"
"","","2022-04-20 02:52:00+00:00","False","5","0","18","0","lewis hamilton mclaren tony stewart stewarthaas racing watkins glen via getty images nascar","neutral"
"","","2022-04-20 02:49:00+00:00","False","1","0","4","0","otd lewis hamilton chinese grand prix nico rosberg fernando alonso fourth straight win mercedes start season making first time since renault teams seasons first four races","positive"
"","","2022-04-20 02:39:47+00:00","False","0","0","0","0","started binging formula documentary netflix instead studying history test tmr one thing gleaned lewis hamilton sore loser also daniel ricciardo best boy bc im mclaren stan btw","positive"
"","","2022-04-20 02:38:13+00:00","False","0","0","1","0","hamiltonwe seen alonso ferrari pairing alreadythey near end careers age says anyway id rather see lewis finish ferrari seeing red would insane regardless results see driving team","neutral"
"","","2022-04-20 02:15:02+00:00","False","0","0","2","0","lewis hamilton precious angel","positive"
"","","2022-04-20 01:43:59+00:00","False","3","3","86","1","best ever lewis hamilton valtteri bottas toto wolff","positive"
"","","2022-04-20 01:37:03+00:00","False","0","0","0","0","sports lewis hamilton odds downbeat toto wolffs recent title comments","negative"
"","","2022-04-20 01:20:10+00:00","False","0","0","0","0","cornerbacks derek stingley sauce gardner andrew booth trent mcduffie kaiir elamsafeties kyle hamilton lewis cine daxton hill jalen pitre jaquan brisker","neutral"
"","","2022-04-20 00:56:36+00:00","False","0","1","0","0","imagine lewis hamilton max verstappen color blast","neutral"
"","","2022-04-20 00:51:10+00:00","False","0","1","11","0","max verstappen lewis hamilton cohead coaches","neutral"
"","","2022-04-20 00:30:59+00:00","False","0","0","0","0","verstappen little bitch lewis hamilton unreal","negative"
"","","2022-04-20 00:28:15+00:00","False","0","0","4","0","account support lewis hamilton","negative"
"","","2022-04-20 00:00:53+00:00","False","0","1","16","0","saw sir lewis hamilton walking neighborhood","positive"
"","","2022-04-19 23:57:23+00:00","False","0","0","3","0","hamiltons  nick driving go  lewis safuuracing","neutral"
"","","2022-04-19 23:41:26+00:00","False","0","0","0","0","lewis hamilton odds downbeat toto wolffs recent title comments sport","negative"
"","","2022-04-19 23:31:24+00:00","False","0","1","14","0","thought never able ever see sir lewis hamilton race live gp pray witness greatness","positive"
"","","2022-04-19 23:24:47+00:00","False","0","0","0","0","reddit lewis hamilton charcoal lewishamilton formula fnews","neutral"
"","","2022-04-19 23:16:19+00:00","False","1","0","3","0","watched th season formula drive survive fast forwarded everything wasnt max verstappen vs lewis hamilton rivalrylook like season late federer nadal type drama damnmax lewis doods","negative"
"","","2022-04-19 23:15:10+00:00","False","0","0","8","0","favourable track merc time hell lap lewisbut tbh denigration vettel hamilton respective fanbase sillyboth drivers among best ever race grid grateful eras synced","positive"
"","","2022-04-19 23:01:36+00:00","False","1","1","7","0","interesting see hamilton inside crash almost max fans claiming silverstone lewiss fault utterly clueless living denial crashstappen turning hamilton","negative"
"","","2022-04-19 22:48:37+00:00","False","0","0","0","0","support hamilton first mercedes result lewis goes likely george could change team always mclaren though","neutral"
"","","2022-04-19 22:36:51+00:00","False","0","0","0","0","rookie lewis hamilton hoped emulate golf legend tiger woods time champion make","neutral"
"","","2022-04-19 22:30:40+00:00","False","0","1","0","0","thanks lewis hamilton best proud cant wait see idol viva south africa viva","positive"
"","","2022-04-19 22:26:39+00:00","False","0","0","0","0","whip im lewis hamilton yall talking bout","negative"
"","","2022-04-19 22:18:44+00:00","False","0","0","1","0","george russell pleasantly surprised second drivers standings despite issues mercedesalso interest top fights lewis hamilton wish push ahead fight wins","positive"
"","","2022-04-19 22:18:32+00:00","False","0","0","0","0","potentially looking take hamilton remaining years lewis still top game better publicity lh ferrari general fs biggest name fs famous team potentially breaking sports coveted record goosebumps","positive"
"","","2022-04-19 22:15:17+00:00","False","0","0","0","0","lewis hamilton nascar driver","neutral"
"","","2022-04-19 22:14:32+00:00","False","0","1","1","0","lewis hamilton","neutral"
"","","2022-04-19 22:14:06+00:00","False","0","1","1","0","lewis hamilton flavor worst ive ever tried","negative"
"","","2022-04-19 21:46:14+00:00","False","0","0","1","0","went disliking lewis hamilton wanting end domination really liking hes one favorite drivers think something changed around turkey seeing win th completely changed view hope changes people th","positive"
"","","2022-04-19 21:37:00+00:00","False","1","0","0","0","george russell pleasantly surprised second drivers standings despite mercedes issuesalso says interest top fights lewis hamilton wish push ahead fight wins","positive"
"","","2022-04-19 21:34:30+00:00","False","0","1","0","0","see tweet pic write lewis hamilton one first scream racismwhy understand never okay abuse anyone often said cry racism racist","negative"
"","","2022-04-19 21:29:02+00:00","False","1","0","0","1","lewis hamilton history maker shipped uk world wide","neutral"
"","","2022-04-19 21:26:43+00:00","False","0","0","0","0","im afraid lewis hamilton come outside","negative"
"","","2022-04-19 21:19:05+00:00","False","0","4","19","0","however thing want car ride lewis hamilton","positive"
"","","2022-04-19 21:17:31+00:00","False","0","0","0","0","lewis hamilton odds downbeat toto wolffs recent title comments","negative"
"","","2022-04-19 21:15:46+00:00","False","0","1","0","0","yes lewis hamilton twitter subject followcan help figure anything else","neutral"
"","","2022-04-19 21:08:39+00:00","False","0","1","0","0","alright lewis hamilton","neutral"
"","","2022-04-19 21:07:22+00:00","False","0","1","2","0","watching formula netflix series drivers pissed lewis hamilton charles leclerc george russelli swear im picking drivers currently well im picking ones dont seem jerkfaces","negative"
"","","2022-04-19 21:05:16+00:00","False","0","1","2","0","safeties get past hamilton interesting rank top guys go dax hill brisker lewis cine could see argument saf","neutral"
"","","2022-04-19 21:05:02+00:00","False","0","0","1","1","support arsenal lewis hamilton theyre already wasting everyones time","negative"
"","","2022-04-19 21:01:08+00:00","False","0","1","5","0","edit leave mind goat lewis hamilton","neutral"
"","","2022-04-19 20:58:00+00:00","False","2","0","17","0","pedro de la rosa pinpointed exactly makes fernando alonso lewis hamilton max verstappen charles leclerc special","positive"
"","","2022-04-19 20:57:49+00:00","False","0","1","0","0","lewis hamilton kyle mcfadzean experienced heads decline still standouts","neutral"
"","","2022-04-19 20:54:50+00:00","False","2","2","18","0","lewis hamilton quite good racing cars love","positive"
"","","2022-04-19 20:47:44+00:00","False","0","0","0","0","every race week thing","negative"
"","","2022-04-19 20:47:04+00:00","False","0","0","0","0","topps chrome formula lewis hamilton purple green refractorebay","neutral"
"","","2022-04-19 20:46:50+00:00","False","0","1","2","0","lewis hamilton subject lmao","neutral"
"","","2022-04-19 20:46:39+00:00","True","0","0","0","0","local train broke lewis hamilton driving shit box need obiwan kenobi flop cry peace","negative"
"","","2022-04-19 20:45:21+00:00","False","0","0","2","0","pull coop gas station feeling like lewis hamilton take money fill gas fast like championship line sum","neutral"
"","","2022-04-19 20:44:57+00:00","False","0","0","3","0","pm good result lewis hamilton","positive"
"","","2022-04-19 20:38:52+00:00","False","0","1","1","0","let give follow mentioned two things like  lewis hamilton things must interesting","positive"
"","","2022-04-19 20:38:37+00:00","False","11","1","130","0","sir lewis hamilton literally goat bro idk else tell","neutral"
"","","2022-04-19 20:28:34+00:00","False","1","0","0","0","lewis hamilton sulking prospect winning eighth title says twotime champion mika hakkinen lewis disaster wonder lewis behaves team meetingsi bet hes sulking imagine sulking formula hamilton","negative"
"","","2022-04-19 20:27:47+00:00","False","3","1","9","2","honestly lewis hamilton pierre gasly liverpool football team dont wanna know tbh","neutral"
"","","2022-04-19 20:14:18+00:00","False","0","0","0","0","cant believe alive jordan lebron tiger steph polamalu lewis hamilton tom brady","positive"
"","","2022-04-19 20:11:35+00:00","False","0","0","0","0","understand easier cuz develop thick skin sports related disappointments lewis hamilton vs nico rosberg title fight almost broke","neutral"
"","","2022-04-19 20:10:52+00:00","False","0","0","0","0","time drivers security bs scumbag crap charlesleclerc","negative"
"","","2022-04-19 20:02:15+00:00","False","0","0","1","0","liked one tweet lewis hamilton suddenly tl filled face","positive"
"","","2022-04-19 20:01:26+00:00","False","0","0","0","0","lewis hamilton says every driver style find contacting us car reflects driver lewishamilton carstyle cars car classiccar instacars auto carlifestyle carslovers supercars","neutral"
"","","2022-04-19 19:58:39+00:00","False","0","1","2","0","thing left soon lewis hamilton also like us","neutral"
"","","2022-04-19 19:54:57+00:00","False","0","10","4","16","unfollowed lewis hamilton subject website hyperbolic morons like like lewis followers insufferablethank adding useless garbage curated aspect twitter essentially ruining topic one might enjoy","negative"
"","","2022-04-19 19:53:26+00:00","False","0","0","1","0","iln continues frost advisory valid apr edt fayette franklin union lewis mason ky adams brown butler clermont clinton hamilton highland warren oh till apr edt","neutral"
"","","2022-04-19 19:48:21+00:00","False","4","4","10","1","kiwi adult film actress awarded insidious bullying neighbours","neutral"
"","","2022-04-19 19:44:10+00:00","False","0","0","0","0","lewis hamilton charles leclerc collide finish race","neutral"
"","","2022-04-19 19:42:32+00:00","False","0","0","0","0","lewis hamilton valentino rossi swap rides switch","neutral"
"","","2022-04-19 19:33:35+00:00","False","0","0","0","0","lewis hamilton urged condemn mercedes sponsorship deal grenfell tower cladding firm","neutral"
"","","2022-04-19 19:30:26+00:00","False","0","0","0","0","manchester city fan inter miami fan steph curry lewis hamilton fan","neutral"
"","","2022-04-19 19:26:07+00:00","False","0","0","0","0","charles leclerc robbed fan asking photo stars watch snatchedcharles vanity cost dear wear regular timex make known keep expensive ones special moment","negative"
"","","2022-04-19 19:24:11+00:00","False","0","0","1","0","cindy kimberly aspire discovered justin bieber dated lewis hamilton probably made timothe well thats flex","positive"
"","","2022-04-19 19:20:49+00:00","False","0","0","0","0","news live mercedes enormous work sulking lewis hamiltons carviahe hasnt sulking load bs","neutral"
"","","2022-04-19 19:18:57+00:00","False","0","0","9","0","sis made entire pinterest board lewis hamilton spammed whatsapp wants start watching attend gp done loving thisssssssssss tried get ages","positive"
"","","2022-04-19 19:18:06+00:00","False","0","0","0","0","sports discussing replacing russian gp circuit lewis hamilton called boring","negative"
"","","2022-04-19 19:15:24+00:00","False","0","0","2","0","saftey lower value position hamilton top level talent additional nd round level players  kyle hamilton lewis cine jaquan brisker dalton hill jalen pitee","neutral"
"","","2022-04-19 19:05:29+00:00","False","0","0","1","0","love lewis hamilton","positive"
"","","2022-04-19 19:01:15+00:00","False","0","1","1","0","need lewis hamilton","neutral"
"","","2022-04-19 18:57:24+00:00","False","0","1","1","0","im gonna let know im gonna pant moan every sir lewis hamilton post makes onto timeline","negative"
"","","2022-04-19 18:52:28+00:00","False","0","0","0","0","formula lewis hamilton mercedes competitive win races despite poor start","positive"
"","","2022-04-19 18:52:00+00:00","False","0","0","4","0","look topps chrome red checkered flag refractor lewis hamilton ending auction tonight ebay","neutral"
"","","2022-04-19 18:50:26+00:00","False","0","0","0","0","im consider muting words lewis hamilton much im fan constant craziness twitter around name almost unbearable","negative"
"","","2022-04-19 18:46:23+00:00","False","0","1","1","0","lewis hamilton race finishes without mercedes worse mazepindo see irony","negative"
"","","2022-04-19 18:38:17+00:00","False","0","1","1","0","lewis hamilton hamler lebron prices","neutral"
"","","2022-04-19 18:37:23+00:00","False","0","0","0","0","lewis hamilton etc shouldnt get mil race driving car around eitherdifference one willing pay watch drive play football","negative"
"","","2022-04-19 18:34:39+00:00","False","0","0","0","0","lewis hamilton ugly said anyway preach max charles hotness","negative"
"","","2022-04-19 18:33:36+00:00","False","0","0","1","0","okay ferrari think youre getting lewis hamilton time soon stop holding hopes","negative"
"","","2022-04-19 18:31:40+00:00","False","0","1","0","0","keep please names michael masi name keep coming relation lewis hamilton abu dhabi stolen championship crashtappen absolutely nothing","negative"
"","","2022-04-19 18:31:24+00:00","False","0","0","0","0","oh god lewis hamilton","neutral"
"","","2022-04-19 18:28:19+00:00","False","0","0","0","0","charles leclerc robbed fan asking photo stars watch snatched","negative"
"","","2022-04-19 18:12:13+00:00","False","0","0","0","0","looking forward seeing legend sir lewis hamilton race weekend","positive"
"","","2022-04-19 18:11:11+00:00","False","0","0","1","0","nfl draft top safetiesvia","neutral"
"","","2022-04-19 18:10:30+00:00","False","1","2","23","0","tryna find nba equivalent rn anyway lewis hamilton mayweather mike phelps stop funny","negative"
"","","2022-04-19 18:08:13+00:00","False","4","0","98","0","george russellsayslewis hamiltonjust doesnt give keep pushing wanted shot keeping behind teamlh gr australiangp","neutral"
"","","2022-04-19 18:05:16+00:00","False","0","0","0","0","rookie lewis hamilton hoped emulate golf legend tiger woods time champion makeit","neutral"
"","","2022-04-19 17:50:21+00:00","False","0","0","0","1","charles leclerc robbed fan asking photo stars watch snatchedits ok given watch cost nothing theyll give another one","neutral"
"","","2022-04-19 17:45:01+00:00","False","0","0","1","0","one bitter rivalries time formula mercedes hamilton lewis","negative"
"","","2022-04-19 17:40:05+00:00","False","0","0","0","0","discussing replacing russian gp circuit lewis hamilton called boring","negative"
"","","2022-04-19 17:40:04+00:00","False","0","0","0","0","discussing replacing russian gp circuit lewis hamilton called boring","negative"
"","","2022-04-19 17:39:59+00:00","False","0","0","0","0","teenager set next one grid looks emulateand meetsir lewis hamilton","neutral"
"","","2022-04-19 17:34:09+00:00","False","0","0","0","0","discussing replacing russian gp circuit lewis hamilton called boring sport","negative"
"","","2022-04-19 17:30:21+00:00","False","0","1","1","0","safety kyle hamilton dax hill lewis cine jaquan brisker kerby joseph jalen pitre nick cross bryan cook sterling weatherford verone mckinley smoke monday woods yusuf corker brandon bolden","neutral"
"","","2022-04-19 17:27:02+00:00","False","0","0","0","0","incredible hes done amazing job lewis hamilton full praise george russell following first podium australian gp formula georgerussell","positive"
"","","2022-04-19 17:24:20+00:00","False","0","0","1","0","sir lewis hamilton timeless legend","positive"
"","","2022-04-19 17:22:01+00:00","False","0","4","5","0","thats seals deal im longer verstappen fan ive fan since lived holland since longer support keeps crashing im going support lewis hamilton knows win real championship goodbye","negative"
"","","2022-04-19 17:21:03+00:00","False","0","0","0","0","exam day teacher said leave class finished exam started saw fraud leaving class asked teacher said lewis hamilton already finished thats hes leaving shame lewis","negative"
"","","2022-04-19 17:20:26+00:00","False","1","1","7","0","press galaxy love lewis hamilton   ","positive"
"","","2022-04-19 17:17:00+00:00","False","0","0","4","0","last season nfl defenses saw significant jump twohigh twodeep safety coverage usagedraft prospects kyle hamilton daxton hill lewis cine fit moldlooks tape","neutral"
"","","2022-04-19 17:12:35+00:00","False","0","0","0","0","lewis hamiltons fanbase might even low iq ronaldos hes wearing mclaren race suit avi","negative"
"","","2022-04-19 17:10:35+00:00","False","1","0","1","0","lewis hamilton tipped challenge wins matter weeks save season","neutral"
"","","2022-04-19 17:06:51+00:00","False","0","0","1","0","least lewis hamilton mention golden wear little golden booties drives","neutral"
"","","2022-04-19 17:06:30+00:00","False","0","0","0","0","topps chrome lewis hami sportscards","neutral"
"","","2022-04-19 17:06:10+00:00","False","0","0","0","0","taking stock new poll position lewis hamilton inflation","neutral"
"","","2022-04-19 16:59:34+00:00","False","43","34","1083","7","hamilton fans see two world champions tenths pole still say fastest car make lewis look good","neutral"
"","","2022-04-19 16:53:57+00:00","False","0","0","10","0","thats lost one point came titles glory working masterpiece day one son lewis hamilton successful person bussinesses anthony hamilton","positive"
"","","2022-04-19 16:42:27+00:00","False","2","1","4","0","lewis hamiltons charge field fsprint brazil truly something elsewe cant wait see imola edition sprint bring","positive"
"","","2022-04-19 16:41:48+00:00","False","0","0","0","0","featured art day lewis hamilton poles buy","neutral"
"","","2022-04-19 16:36:05+00:00","False","0","0","0","0","charles leclerc robbed fan asking photo stars watch snatched","negative"
"","","2022-04-19 16:35:32+00:00","False","0","1","0","0","may want read comments champ like said another dutch verstappen fan boy despises mercedes lewis hamilton odd reason","negative"
"","","2022-04-19 16:34:38+00:00","False","0","1","3","0","im lewis hamilton fan im fan","positive"
"","","2022-04-19 16:33:19+00:00","False","0","2","2","0","needs ssris lewis hamilton","neutral"
"","","2022-04-19 16:32:05+00:00","False","0","0","1","0","mercedes chiefs comments music lewis hamilton george russells earschief strategist james vowles insists silver arrows working hard behind scenes progress car championship winner","positive"
"","","2022-04-19 16:28:50+00:00","False","3","3","28","2","players like thein st round wouldnt take sooner kyle hamilton garrett wilson jermaine johnson stingley jr jameson williams karlaftis jordan davis treylon burks lewis cine jahan dotson flyeaglesfly","positive"
"","","2022-04-19 16:25:41+00:00","False","0","0","0","0","lewis hamilton greatest time","positive"
"","","2022-04-19 16:24:56+00:00","False","0","0","0","0","reminder lewis hamilton greatest driver time lh","positive"
"","","2022-04-19 16:23:13+00:00","False","0","0","0","0","sprint race lewis hamilton interlagos remembered masterclass","positive"
"","","2022-04-19 16:20:38+00:00","False","0","1","0","0","im team lewis hamilton mercedes amg george russell guy dont like max verstappen christian horner driver checo perez cool charles leclerc ferrari tear far","positive"
