"place","coords","created_at","possibly_sensitive","retweet_count","reply_count","like_count","quote_count","text","sentiment"
"","","2022-04-19 00:34:51+00:00","False","0","1","5","0","member hamilton cosmopolitan club id furious dues used personal spat manager lisa lewis","negative"
"","","2022-04-19 00:31:48+00:00","False","0","0","10","0","top tribute speech communications class mine lewis hamilton course teacher liked got today truly day","positive"
"","","2022-04-19 00:30:16+00:00","False","0","0","1","0","embracing inner lewis hamilton tonight excited","positive"
"","","2022-04-19 00:23:21+00:00","False","0","0","0","1","proof need leave late save name legacy life name racists leave please evidence mercedes boss toto wolff served lewis hamilton  via","neutral"
"","","2022-04-19 00:20:30+00:00","False","0","1","3","0","guys lewis hamilton","neutral"
"","","2022-04-19 00:11:22+00:00","False","0","0","0","0","another driver whos name many heard simply used sir lewis hamiltons name get attention bitter sounding opinion doubt anyone really cared hearing opinion likely begged write","negative"
"","","2022-04-18 23:46:47+00:00","False","0","0","0","0","garbage reporting course sulking cheap news reporting dramatising lewis hamiltons teams problems back dramatisation newspaper needs bin garbage","negative"
"","","2022-04-18 23:36:07+00:00","False","0","1","0","0","want leclerc russell sainz expect leclerc perez hamiltonlets clear id mention max hes tons problems lately lewis really think good qualy get bronzeand checo hes giving reasons believe","positive"
"","","2022-04-18 23:30:03+00:00","False","0","1","11","0","got lewis hamilton monster energy dollar store figured going find plain silver cheap wrap underneath pearlescent beautiful finish would hide us","neutral"
"","","2022-04-18 23:24:47+00:00","False","0","0","2","0","train station toilets literally craziest shit know lewis hamilton meant crazy bomb saw theee","negative"
"","","2022-04-18 23:13:13+00:00","False","0","0","0","0","good news im learning drive advice driver reference favorite lewis hamilton","positive"
"","","2022-04-18 23:10:36+00:00","False","0","0","2","0","worldclass group seen lewis hamilton thread good","positive"
"","","2022-04-18 23:07:31+00:00","False","0","0","0","0","good news im learning drive advice driver reference favorite lewis hamilton","positive"
"","","2022-04-18 23:02:24+00:00","False","0","0","0","0","mall asia lewis hamiltons glorious first world drivers title mclaren car mall chrome vodafone glory","positive"
"","","2022-04-18 23:00:08+00:00","False","1","0","1","0","weekend hotsy monster truck takes air hamilton monster jam friday saturday firstontario centre hamilton come cheer team get informationshane lewis monsterjam hotsy","positive"
"","","2022-04-18 22:53:44+00:00","False","0","0","12","0","please besties im dying majority grid talented racing still inadequate compared lewis hamilton meanwhile hes renaissance man gazillion hobbies talents lmao kill","negative"
"","","2022-04-18 22:49:27+00:00","False","0","0","0","0","probably even hate mercedes hate lewis hamilton","negative"
"","","2022-04-18 22:41:59+00:00","False","0","0","0","0","deepest safety class remember also lots good wr ol edge guys premium positions go ahead guys safety likely go ahead briskerkyle hamilton daxton hill jalen pitre lewis cine","positive"
"","","2022-04-18 22:24:13+00:00","False","0","0","0","0","thanks think stick original fashion advisor lewis hamilton","positive"
"","","2022-04-18 22:15:31+00:00","False","0","0","6","0","way lewis hamilton idea put worst video world","negative"
"","","2022-04-18 22:14:54+00:00","False","1","0","4","0","reading article uk express really lewis hamilton shame english newspaper cant support times wdc","negative"
"","","2022-04-18 22:10:45+00:00","False","4","5","76","1","left lewis hamilton would feel proud sometimes marry best friend soulmate upgrade lewis hamilton know theyre best friend soulmate going get races","positive"
"","","2022-04-18 22:01:14+00:00","False","0","0","0","0","better sick joke lewis hamilton","negative"
"","","2022-04-18 21:58:50+00:00","False","0","0","1","0","really believe rains imola lewis hamilton win race think mercedes good car currently disturbed much full throttle high speed rain reduce also believe reason strong monaco imolagp","positive"
"","","2022-04-18 21:58:06+00:00","False","0","2","1","0","would also argue many talented drivers im big fan many drivers ranging max lewis hamilton pierre gasly even dont like driver think least worth respecting","positive"
"","","2022-04-18 21:55:47+00:00","False","0","0","0","0","like way lewis hamilton thinks sas problems hes acknowledged truth history mark champion","positive"
"","","2022-04-18 21:51:50+00:00","False","0","0","9","0","coz lewis hamilton choke hold like ive never loved man much doesnt even know exist","negative"
"","","2022-04-18 21:51:31+00:00","False","0","0","1","0","waking suhoor theres lewis freaking hamiltons latest instagram post","neutral"
"","","2022-04-18 21:48:40+00:00","False","0","0","0","0","gorgeous gorgeous gorgeous girls support lewis hamilton","positive"
"","","2022-04-18 21:46:04+00:00","False","0","0","0","0","abel tesfaye lewis hamilton whoring see","neutral"
"","","2022-04-18 21:45:00+00:00","False","2","0","10","0","lewis hamilton made feelings clear ","neutral"
"","","2022-04-18 21:39:02+00:00","False","1","0","4","0","lewis hamilton normally hes pretty handsome around  pretty handy wanted say go handsome well look ","positive"
"","","2022-04-18 21:37:04+00:00","False","0","0","0","0","supportand lewis hamilton cant mad charles fantastic season","positive"
"","","2022-04-18 21:34:25+00:00","False","0","1","3","0","heres lewis hamilton bless timeline race week","positive"
"","","2022-04-18 21:32:05+00:00","False","0","0","0","0","lewis hamilton would give try","positive"
"","","2022-04-18 21:30:16+00:00","False","0","0","0","0","suppose reason max penalised corner cut lewis wasnt car positioning reason max cut corner hamilton side hamilton could claim room left wasnt lie explain decision penalise","neutral"
"","","2022-04-18 21:29:27+00:00","False","0","0","2","0","sir lewis hamilton broke social media today instagram post","neutral"
"","","2022-04-18 21:23:52+00:00","False","0","1","3","0","lol ad got puppy named lewis hamilton could mimic bono say get lewis time actually end saying constantly one else ever said lewis hamilton get bed","neutral"
"","","2022-04-18 21:15:29+00:00","False","0","0","0","0","lewis hamilton supremacy","neutral"
"","","2022-04-18 21:13:15+00:00","False","0","0","0","0","yeah boys finally got win im really happy want dedicate one fans always supported matter sir lewis hamilton canada mclaren mercedes istandwithlewishamilton teamlh","positive"
"","","2022-04-18 21:13:07+00:00","False","0","1","0","0","look like wrong tbh knew empty words itd popular year still sore lewis winning itll interesting see tune hamilton suffers another barren year","neutral"
"","","2022-04-18 21:12:14+00:00","False","0","0","0","0","dare saying positive thing driver whos name sir lewis hamilton garbage lap compare sir lewis hamiltons swear hamilton fanboys every single related posts","negative"
"","","2022-04-18 21:08:01+00:00","False","61","16","456","3","facts sir lewis hamilton keep saying car hes winning since kid put respect name lewishamilton","positive"
"","","2022-04-18 21:04:06+00:00","False","0","2","0","0","wdc massively irrelevant hamilton loses championship irrelevantthe simple mind lewis hamilton fan","negative"
"","","2022-04-18 21:00:13+00:00","False","0","0","7","0","daily express seems thing lewis hamilton every article ive read recently negative hes sulky could leave mercedes hes happy new car negative comments drivers said sick reading","negative"
"","","2022-04-18 20:58:57+00:00","False","0","0","0","0","bullshit clickbait fakenews looks like ","negative"
"","","2022-04-18 20:56:50+00:00","False","0","0","0","0","wena fixing roads tlogele bo lewis hamilton wena transport","negative"
"","","2022-04-18 20:53:59+00:00","True","0","0","0","0","lewis hamilton suffering mercedes partner george russell due spoiledcriticized twats chavs lack class pride plus racism every day meal","negative"
"","","2022-04-18 20:53:20+00:00","False","0","0","2","0","lewis hamilton current champion every investigation last season proved fia pretending cheats redbull verstappen championship investigated put matter right","neutral"
"","","2022-04-18 20:46:29+00:00","False","0","0","1","0","chase elliott superfans beating cody ware bristol dirt stuff like lewis hamilton fans beat nick latifi oh wait","negative"
"","","2022-04-18 20:45:50+00:00","False","0","0","0","0","lewis hamilton lomlthats","positive"
"","","2022-04-18 20:43:09+00:00","False","0","0","0","0","thought lewis hamilton timespeed kills bafwethu","negative"
"","","2022-04-18 20:32:13+00:00","False","1","0","13","0","used name justify friends transphobia lewis hamiltons internet dont think even joke lmao","negative"
"","","2022-04-18 20:30:21+00:00","False","0","2","11","0","made best friend become nr lewis hamilton fan even names lewin","positive"
"","","2022-04-18 20:29:18+00:00","False","0","0","1","0","lewis hamilton chill second","neutral"
"","","2022-04-18 20:27:51+00:00","False","0","0","0","0","annabeth steve rogers lewis hamilton trending time alive","positive"
"","","2022-04-18 20:27:45+00:00","False","1","2","47","1","things im seeing lewis hamiltons internet","positive"
"","","2022-04-18 20:27:17+00:00","False","0","3","12","0","one thing learnt drive survive lewis hamilton got truly screwed","negative"
"","","2022-04-18 20:25:30+00:00","False","0","0","15","0","next best safeties kyle hamilton lewis cine daxton hill think worthy top picks also think talent safety class market slow safety guys like edmunds tartt mathieu etc","positive"
"","","2022-04-18 20:22:55+00:00","False","0","0","3","0","lewis hamilton time world champion charles win wholesome moots ","positive"
"","","2022-04-18 20:20:29+00:00","False","0","0","1","0","lewis hamilton time world champion charles win wholesome moots ","positive"
"","","2022-04-18 20:14:37+00:00","False","0","0","7","0","thats sir lewis hamilton","neutral"
"","","2022-04-18 20:10:18+00:00","False","0","0","3","0","lewis hamilton raising standards men untouchable level","positive"
"","","2022-04-18 20:09:55+00:00","False","0","0","0","0","lewis hamilton lord","neutral"
"","","2022-04-18 20:07:33+00:00","False","1","0","18","1","lewis hamilton pierre gasly holy month ramadanand easter monday yall evil","negative"
"","","2022-04-18 20:06:22+00:00","False","0","0","8","0","one compares lewis hamilton hes top top","positive"
"","","2022-04-18 20:04:46+00:00","False","1","4","20","0","temptation ure read bible lewis hamilton post devil works hard lh works harder","negative"
"","","2022-04-18 20:03:15+00:00","False","0","0","5","0","lewis hamilton que isso homem","positive"
"","","2022-04-18 20:01:45+00:00","False","0","1","0","0","sir lewis hamiltonis perfecti died little","positive"
"","","2022-04-18 19:58:56+00:00","False","1","3","22","1","lewis hamilton imo overrated formula driver time","negative"
"","","2022-04-18 19:57:22+00:00","False","0","2","0","0","heard moving avoid tax winnings oops  shes comp  mean deals yep shes another lewis hamilton shes save money  hit money grabber  fool","negative"
"","","2022-04-18 19:56:19+00:00","False","0","0","1","0","cant even pronouns never thing lewis hamilton anymore ffs","negative"
"","","2022-04-18 19:50:21+00:00","False","0","0","11","0","sir lewis hamilton time formula one world champion gave passionate talk selfimprovement high performance atlast week annual event continues bring inspiration transformation global commerce industry vtexday","positive"
"","","2022-04-18 19:49:54+00:00","False","0","0","1","0","sir lewis hamilton bring back khayalami kyalami track still good","positive"
"","","2022-04-18 19:48:52+00:00","False","0","1","3","0","ever meet lewis hamilton ima tell hes taller expected boost baes confidence lil bit","positive"
"","","2022-04-18 19:40:32+00:00","False","0","0","1","0","extreme lewis hamilton fans","neutral"
"","","2022-04-18 19:40:07+00:00","False","0","0","0","0","norris definitely hamilton far behind","neutral"
"","","2022-04-18 19:39:56+00:00","False","0","0","1","0","lewis carl davidson larbalestier hamilton actual fuck omg","negative"
"","","2022-04-18 19:39:34+00:00","False","0","0","1","0","sir lewis hamilton doh said self respecting","negative"
"","","2022-04-18 19:39:33+00:00","False","0","0","2","0","ah yes local takeaway delivery drivers tend badly modified golfs think theyre lewis hamilton speedyet anytime order takeaway arrives hour half later cold","negative"
"","","2022-04-18 19:32:28+00:00","False","0","2","9","0","mobay kgn hrs lewis hamilton im ready race","neutral"
"","","2022-04-18 19:32:12+00:00","False","0","1","0","0","energy like hating lewis hamilton winning goddamn time accept gratness goat era still enjoy guys like max took peg like last yearkeep dream alive time come make smile","neutral"
"","","2022-04-18 19:31:26+00:00","False","0","0","3","0","lewis hamilton  chill contenti cant keep","negative"
"","","2022-04-18 19:31:24+00:00","False","0","0","1","0","deep everyone knows lewis hamilton robbed abu dhabi","negative"
"","","2022-04-18 19:30:59+00:00","False","0","0","0","0","hi name isa new ftwt new favourite drivers lewis hamilton george russell im looking find moots","positive"
"","","2022-04-18 19:30:50+00:00","False","1","3","12","0","lewis hamilton actually makes angry like whyyyyyyy","negative"
"","","2022-04-18 19:29:59+00:00","False","3","0","11","0","lewis hamilton making us go insane","negative"
"","","2022-04-18 19:29:46+00:00","False","1","0","18","0","lewis hamilton flawless idc","positive"
"","","2022-04-18 19:29:23+00:00","False","0","1","1","0","lewis hamilton","neutral"
"","","2022-04-18 19:27:54+00:00","False","0","0","9","0","lewis hamilton wtf","negative"
"","","2022-04-18 19:27:23+00:00","False","0","0","2","0","lewis hamilton need look else","positive"
"","","2022-04-18 19:26:56+00:00","False","0","0","0","0","forgiven  regards lewis hamilton fan since","positive"
"","","2022-04-18 19:26:08+00:00","False","29","9","310","1","lewis hamilton literally perfect like theres one like","positive"
"","","2022-04-18 19:25:14+00:00","False","1","5","12","1","mercy us lewis hamilton dear brother christ sorry whatever","negative"
"","","2022-04-18 19:21:32+00:00","False","0","0","1","0","context lewis hamilton best driver time","positive"
"","","2022-04-18 19:20:56+00:00","False","0","0","0","0","im marrying lewis hamilton btw","neutral"
"","","2022-04-18 19:20:54+00:00","False","0","0","0","0","lewis hamilton menace society needs stopped pictures posts illegali volunteer bed holding cell resolve","negative"
"","","2022-04-18 19:20:28+00:00","False","0","2","1","0","sorry like lewis hamilton next time ill wait til marriage","neutral"
"","","2022-04-18 19:19:29+00:00","False","0","0","1","0","jealous man name lewis hamilton","negative"
"","","2022-04-18 19:19:06+00:00","False","0","1","0","0","simply shouldnt chance win championship champion best driver whole season lewis hamilton misses races theres chance hell still wins wdc horrible points system waiver worked kyles favor micky mouse","negative"
"","","2022-04-18 19:18:45+00:00","False","4","1","82","0","lewis hamilton coolest man thanks coming ted talk","positive"
"","","2022-04-18 19:17:09+00:00","False","1","1","7","0","id prefer lewis hamilton","neutral"
"","","2022-04-18 19:17:08+00:00","False","0","1","23","0","tge fact gaslys radio makes even sense yk sir lewis hamilton","positive"
"","","2022-04-18 19:16:57+00:00","False","2","0","15","0","dear lord cant lewis hamilton please find man looks exactly like lewis hamilton packing like lewis hamilton whos also fucking nice thank","positive"
"","","2022-04-18 19:16:25+00:00","False","0","1","0","0","skyle hamilton unicorn st safety draft early mid st rounddax hill lot malcom jenkins vibes play secondary likey st rounderlewis cine nasty thumper could warrant lat st early nd round consideration","positive"
"","","2022-04-18 19:14:22+00:00","False","7","2","85","9","ever attracted men sir lewis hamilton exists guys im fuckedthis fuckkng sick","negative"
"","","2022-04-18 19:12:04+00:00","False","0","0","0","0","lewis hamilton always famous","positive"
"","","2022-04-18 19:11:08+00:00","False","0","0","4","0","know peace since lewis hamilton discovered tank tops","negative"
"","","2022-04-18 19:10:06+00:00","False","1","0","5","0","lewis hamilton tf think king youd correct","negative"
"","","2022-04-18 19:06:19+00:00","False","15","0","113","0","wanna thank carmen larbalestier anthony hamilton creating son lewis hamilton beautiful human alive","positive"
"","","2022-04-18 19:05:34+00:00","False","0","0","0","0","oh god jackson wang lewis hamilton would besties know","positive"
"","","2022-04-18 19:04:38+00:00","False","0","2","17","0","lewis hamilton heartbeat","positive"
"","","2022-04-18 19:04:11+00:00","False","8","3","64","0","im afraid one ever compare  men start apologizing lewis hamilton","negative"
"","","2022-04-18 19:03:00+00:00","False","2","1","33","0","work art called lewis hamilton","positive"
"","","2022-04-18 19:02:39+00:00","False","0","0","1","0","lewis hamilton youre reading free thursday night would like hang free thursday night free hang free hang thursday night want hang thursday night free","positive"
"","","2022-04-18 19:02:18+00:00","False","0","0","5","0","sir lewis hamilton expect live laugh love","neutral"
"","","2022-04-18 19:02:00+00:00","False","604","42","6891","165","lewis hamilton tht thing ","positive"
"","","2022-04-18 19:01:39+00:00","False","9","3","116","1","god man name lewis hamilton","positive"
"","","2022-04-18 19:00:20+00:00","False","3","0","31","0","sir lewis carl davidson hamiltonlarbalestier whore love","positive"
"","","2022-04-18 19:00:18+00:00","False","0","1","0","0","lewis hamilton cried","neutral"
"","","2022-04-18 18:59:20+00:00","False","0","0","3","0","lets honest lewis hamilton level one reach mean meet could someone else overcome","negative"
"","","2022-04-18 18:59:02+00:00","False","9","1","79","1","sir lewis hamiltons race vibe unmatched","positive"
"","","2022-04-18 18:58:17+00:00","False","0","0","8","0","everyone tl whore sir lewis hamilton","negative"
"","","2022-04-18 18:58:04+00:00","False","0","3","27","0","looks inoffensive meme making fun rb furiously googles lewis hamilton cries fit rage comes back tweeter tweet","negative"
"","","2022-04-18 18:57:47+00:00","True","0","0","1","0","lewis hamilton greatest driver alive","positive"
"","","2022-04-18 18:57:02+00:00","False","0","0","2","0","lewis hamilton insane","negative"
"","","2022-04-18 18:56:10+00:00","False","0","0","1","0","washed loser hypocrite overpaid oh favourite poundshop lewis hamilton","negative"
"","","2022-04-18 18:56:04+00:00","False","0","0","1","0","im bisexual attack sir lewis hamilton","negative"
"","","2022-04-18 18:56:03+00:00","False","0","0","0","0","think die went heaven seeing lewis hamilton pictures","positive"
"","","2022-04-18 18:55:43+00:00","False","0","0","0","0","include abu dabi grandprix result determined race director inventing rules ensuring lewis hamilton win th world title thehave conceded human error made final lap degrading nominees","negative"
"","","2022-04-18 18:55:04+00:00","False","0","2","17","0","sir lewis hamilton likes fed us good content delete","neutral"
"","","2022-04-18 18:54:22+00:00","False","0","3","25","0","sir lewis hamilton going everywhere","neutral"
"","","2022-04-18 18:54:18+00:00","False","4","1","29","1","lewis hamilton illegal every country","negative"
"","","2022-04-18 18:53:37+00:00","False","0","0","14","0","sir lewis hamilton right","negative"
"","","2022-04-18 18:53:19+00:00","False","0","0","15","0","sir lewis hamilton man","neutral"
"","","2022-04-18 18:53:09+00:00","False","0","0","1","0","lewis hamilton one hell man","positive"
"","","2022-04-18 18:51:57+00:00","False","0","1","0","0","holy shit sir lewis hamilton made attempt life","negative"
"","","2022-04-18 18:50:46+00:00","True","0","1","0","0","year last race australia","neutral"
"","","2022-04-18 18:50:35+00:00","False","4","1","29","0","lewis hamilton insane","positive"
"","","2022-04-18 18:49:42+00:00","False","0","0","0","0","mercedes hamilton partnership goat lets honest mercedes winning without lewis behind wheel whoever best merc drivers winning alot ofs drivers wouldve successful car","positive"
"","","2022-04-18 18:43:47+00:00","False","1","0","5","0","found podcast fellow lewis hamilton supporters love ","positive"
"","","2022-04-18 18:36:38+00:00","False","0","0","1","0","get started lewis hamilton","neutral"
"","","2022-04-18 18:24:54+00:00","False","0","0","1","0","stupid place saw car lewis hamiltons head monza","negative"
"","","2022-04-18 18:24:51+00:00","False","0","0","1","0","mos yall bo lewis hamilton schumacher","neutral"
"","","2022-04-18 18:24:15+00:00","False","0","1","6","0","self respecting lewis hamilton fan supporting leclerc note said self respecting theres lot shameless bitches app","negative"
"","","2022-04-18 18:22:03+00:00","False","0","1","3","0","find mr lewis hamilton lover","neutral"
"","","2022-04-18 18:16:35+00:00","False","0","2","104","0","supporting leclerc champjonship battle rn cause hamilton isnt fight either max leclerc  obvs rooting leclerc cause way rooting mv  still suport lewis always like mv fans suport lewis lewis","positive"
"","","2022-04-18 18:14:02+00:00","False","0","1","1","0","truly new twt arena started husband check profile sons fell crazy lewis hamilton everything stands need mutuals follow follow backagain hold starting","positive"
"","","2022-04-18 18:11:49+00:00","False","0","0","0","1","yet main priority supporting hamilton im supporting charles max nice atheletes foot would lewis charles fightso deal","positive"
"","","2022-04-18 18:11:15+00:00","False","1","0","1","0","lewis hamilton schumacher opinions shove ass","negative"
"","","2022-04-18 18:05:07+00:00","True","0","0","0","0","marc surer lewis hamilton spoiled perfect cars struggles porpoisingwhat stupid old fart idiot keep farright comments arse","negative"
"","","2022-04-18 18:01:19+00:00","False","0","1","0","0","im also growing tired talking point somehow racing history lewis hamilton champion dominant car  folks mad anybody could jumped middling mercedes back hamilton","negative"
"","","2022-04-18 18:00:28+00:00","False","0","0","0","0","read disgusting headline lewis hamilton paper shocking lack support gets british media bet dont report things like max","negative"
"","","2022-04-18 18:00:15+00:00","False","0","0","2","0","followers well case legit new twt started watching husbandand sons fell crazy lewis hamilton stands need mutuals follow follow back hold starting","positive"
"","","2022-04-18 17:59:32+00:00","False","4","1","29","0","long derekgreat white hope warwick hispals arent adjudicating event involving lewis hamilton sure ignoring rulebook way  never happen","negative"
"","","2022-04-18 17:54:10+00:00","False","0","0","2","0","mark surer believes lewis hamilton gotten used perfect cars porpoising affecting competitorsthoughts","neutral"
"","","2022-04-18 17:51:01+00:00","False","0","0","1","0","lights away go lewis hamilton","negative"
"","","2022-04-18 17:50:35+00:00","False","227","21","1875","42","sir lewis hamilton thats tweet","neutral"
"","","2022-04-18 17:48:25+00:00","False","0","1","0","0","rumours lewis hamilton retiring single official source","neutral"
"","","2022-04-18 17:39:38+00:00","False","0","1","0","0","think might like lewis hamilton","positive"
"","","2022-04-18 17:38:36+00:00","False","0","1","1","0","lewis hamilton loosing th title race directoralex rodrguez doping scandal","negative"
"","","2022-04-18 17:36:27+00:00","False","0","2","6","0","hate lewis hamilton","negative"
"","","2022-04-18 17:31:55+00:00","False","0","0","0","0","emma raducanu lewis hamilton harry kane fan shes literally like real","positive"
"","","2022-04-18 17:26:44+00:00","False","0","0","0","0","lewis hamilton car myth exposedvia","neutral"
"","","2022-04-18 17:25:31+00:00","False","1","0","1","0","formulaone mercedes chiefs comments music lewis hamilton george russells ears","positive"
"","","2022-04-18 17:20:14+00:00","False","0","0","0","0","onlewis hamilton valentino rossi swap rides switch full","neutral"
"","","2022-04-18 17:14:38+00:00","False","0","1","1","0","lewis hamilton career finishing personal decision longer partake formula","neutral"
"","","2022-04-18 17:11:42+00:00","False","2","3","4","0","mika hakkinen suggested lewis hamilton may seek future away mercedes teams struggles rectified soon referring sulking hamilton lewishamilton","neutral"
"","","2022-04-18 17:11:06+00:00","False","0","2","2","0","lisa lewis hamilton cosmopolitan club cordial relations new manager arrived things quickly began sour","negative"
"","","2022-04-18 17:09:03+00:00","False","0","1","1","0","lewis hamilton fraud","negative"
"","","2022-04-18 17:08:43+00:00","False","1","0","1","0","top safties kyle hamilton jalen pitre daxton hill jaquon brisker lewis cine kerby joseph bryan cook nick cross sterling weatherford bubba bolden","neutral"
"","","2022-04-18 17:08:05+00:00","False","0","1","2","0","lewis hamilton retiring swear yall need let calm day ffs hyperventilating","negative"
"","","2022-04-18 17:07:22+00:00","False","0","0","15","1","april otd jenson button wins chinese gp mp another masterclass drive jenson mixed conditions nd win teamlewis hamilton finished nd great finish mclarenteam","positive"
"","","2022-04-18 17:05:58+00:00","False","0","0","0","0","know man said lewis hamilton greatest time","positive"
