"place","coords","created_at","possibly_sensitive","retweet_count","reply_count","like_count","quote_count","text","sentiment"
"Port Blandford, Newfoundland and Labrador","48.36,-54.18","2022-04-20 20:18:29+00:00","False","0","0","0","0","im curious baba oreilly tune may played heard shows kingswood hamilton buffalo joe lewis detroit never heard gd version sirius radio yetwould love hear show","positive"
"Coventry, England","52.41,-1.52","2022-04-20 17:37:06+00:00","False","4","1","43","0","lewis hamilton fuji another one best races  time rookie  bossing team mate current wdc alonso car torrential rain  alonso eventually crashed","positive"
"Tamworth, England","52.62,-1.68","2022-04-20 12:51:05+00:00","False","0","2","5","0","fans openly contemptuous towards lewis hamilton pretending race","negative"
"Sydney, New South Wales","-33.85,150.93","2022-04-20 09:46:10+00:00","False","0","0","0","0","carlos sainz contract negotiations stalled lewis hamilton going finish career ferrari ferrari win championshipslewis win wdc ferrari retire","neutral"
"Nairobi, Kenya","-1.27,36.86","2022-04-19 07:33:49+00:00","False","1","2","10","0","lewis hamilton posts thirst trap husband usually first one send ask meare alive breathing ok knows love lh respects  like going thru rihanna heartbreakand respect teamlh","positive"
"Genua, Liguri","44.45,8.88","2022-04-19 06:25:14+00:00","False","0","0","0","0","good morning lewis hamilton best world","positive"
"Botswana","-22.34,24.68","2022-04-18 19:54:27+00:00","False","0","0","0","0","lewis hamilton bulked tf","negative"
"Staines-upon-Thames, South East","51.42,-0.45","2022-04-18 19:13:49+00:00","False","0","0","0","0","sexualising lewis hamilton twitter nah delete account grow try coming back cool","negative"
"Soweto, South Africa","-26.26,27.88","2022-04-18 18:13:59+00:00","False","0","0","0","0","oh lewis hamilton fuck","negative"
"Wandsworth, London","51.45,-0.19","2022-04-18 17:29:09+00:00","False","0","0","2","0","lol seem affect mediocre professional athlete greatest driver time sir lewis hamilton","neutral"
"Aberdeen, Scotland","57.16,-2.13","2022-04-18 16:52:20+00:00","False","1","5","4","0","strange thatis never bordered max lando yukio alonso insulting outburst radio messages ifmake simple radio comment mika formulates sulking quiting theory imolagp","negative"
"Inverness, Scotland","57.47,-4.22","2022-04-18 11:44:42+00:00","False","0","1","2","0","feels kinda gross new lego set mercedes car specifically lewis hamiltons car maybe theres kind issue rights likeness even whitewashing using generic yellow mini figure doesnt seem ok","negative"
"Genua, Liguri","44.45,8.88","2022-04-18 09:16:59+00:00","False","0","0","8","0","bravo bravissimo sir lewis hamilton best world","positive"
"Auckland, New Zealand","-36.60,174.86","2022-04-18 05:13:00+00:00","False","0","2","1","0","lewis little sulk","negative"
"Chicago, IL","41.83,-87.73","2022-04-18 01:23:56+00:00","False","0","0","0","0","fdts season final cant believe im gonna put misery lewis hamilton stand","negative"
"Hamilton, Scotland","55.78,-4.07","2022-04-17 20:43:29+00:00","False","0","0","0","0","wee cat oscar sir lewis hamilton also mine bottas great wish lewis","positive"
"Genua, Liguri","44.45,8.88","2022-04-17 15:40:47+00:00","False","0","0","1","0","buona serata lewis hamilton best world","positive"
"Ramsbottom, England","53.64,-2.33","2022-04-17 14:43:39+00:00","False","0","0","1","0","lewis hamilton valentino rossi swap rides switch fullvia","neutral"
"Genua, Liguri","44.45,8.88","2022-04-17 05:09:37+00:00","False","0","0","1","0","good morning lewis hamilton best world","positive"
"South Africa","-28.48,24.67","2022-04-16 22:48:02+00:00","False","0","0","2","0","theyre bitter achieve lewis hamilton achieved grumpy old men ask shut time gone never return","negative"
"Middlesbrough, England","54.56,-1.22","2022-04-16 21:15:33+00:00","False","1","0","2","0","love lewis one favourite drivers sportsman sport gotten popular usual hamilton dominancevariety good","positive"
"Winterthur, Schweiz","47.50,8.73","2022-04-16 20:10:06+00:00","False","0","0","2","0","questions irma de airton senna emociona lewis hamiltonvia","neutral"
"Biggleswade, England","52.09,-0.25","2022-04-16 17:33:56+00:00","False","0","0","0","0","express anti lewis","negative"
"Genua, Liguri","44.45,8.88","2022-04-16 17:04:29+00:00","False","0","0","0","0","lewis hamilton best worldanche allenamentogrande grandissimo bello bellissimounico","positive"
"Genua, Liguri","44.45,8.88","2022-04-16 16:02:52+00:00","False","0","0","1","0","forza lewis best world  spero che la mercedes sua alla tua altezzahamilton sulking thinking leaving mercedes new team poor start","neutral"
"Central, Kenya","0.08,37.24","2022-04-16 14:47:24+00:00","False","0","2","0","0","lewis hamilton finally podium","neutral"
"Kampala, Uganda","0.29,32.57","2022-04-16 09:34:25+00:00","False","1","0","1","0","good afternoon gang  low week isand lewis hamilton  high week isenjoy holidays lads phil weekend tuwe akatwa otulemese beer easter sebbo yo predictions","positive"
"Montral, Qubec","45.56,-73.72","2022-04-15 19:45:16+00:00","False","244","264","6826","78","tell youre lewis hamilton fan without telling youre lewis hamilton fan teamlh teamlh mercedesamgf mercedesamg mercedes lewishamilton formula formulaone","neutral"
"Johannesburg, South Africa","-26.28,27.97","2022-04-15 17:00:13+00:00","False","0","1","2","0","lewis hamilton says still rise","positive"
"Keyser, WV","39.44,-78.98","2022-04-15 16:04:51+00:00","False","0","0","0","0","todays random west virginia fan sighting lewis hamilton hat guy little caesars keyser","neutral"
"Sungai Buloh, Selangor","3.16,101.58","2022-04-15 14:23:49+00:00","False","0","0","0","0","look waiting rush coffee even approved lewis hamilton rush roastery","positive"
"Boksburg, South Africa","-26.27,28.25","2022-04-15 09:51:03+00:00","False","1","1","3","0","rihanna problemchris brown matt kemp karim benzema lewis hamilton travis scott drakeand asap rockythe woman know keep man","negative"
"Dar es Salaam, Tanzania","-6.88,39.28","2022-04-15 08:36:03+00:00","False","71","106","1036","13","always chris brown matt kemp karim benzema lewis hamilton travis scott drake hassan jameeland asap rockythat woman know keep man","negative"
"Genua, Liguri","44.45,8.88","2022-04-15 07:55:48+00:00","False","0","0","1","0","forza mercedes vogliamo vedere le vere frecce dargento lewis hamilton risk pays mercedes painful preseason decision","neutral"
"Nairobi, Kenya","-1.27,36.86","2022-04-15 07:24:49+00:00","False","4","1","16","0","lewis hamilton dated rihanna wow couple fumbled","negative"
"Genua, Liguri","44.45,8.88","2022-04-15 06:36:07+00:00","False","0","0","0","0","good morning lewis hamilton best worldti amer per sempre come nelle favole","positive"
"Salisbury, England","51.07,-1.80","2022-04-14 16:25:13+00:00","False","0","0","2","0","cards table certainly profess lewis hamilton standards driving roads declined sharply recent years driving shocking lewishamilton","negative"
"Wales, United Kingdom","52.40,-4.00","2022-04-14 09:33:31+00:00","False","0","0","1","0","friendly reminder lewis hamiltons first world championship always known scandal legitimate title","negative"
"Genua, Liguri","44.45,8.88","2022-04-14 07:10:10+00:00","False","0","0","0","0","bello bellissimo lewis hamilton best world","positive"
"Kaduna, Nigeria","10.51,7.42","2022-04-14 06:26:52+00:00","False","0","0","1","0","god pls let see met sir lewis hamilton die","neutral"
"Austin, TX","30.32,-97.75","2022-04-14 01:52:41+00:00","False","0","0","0","0","circuit americas track run lewis hamilton mercdes amg petronas carfun facthad concert sept th","positive"
"Wallasey, England","53.42,-3.05","2022-04-14 00:52:52+00:00","False","2","1","7","0","obvious fia want sir lewis hamilton sport everything possible encourage exitis spineless puppet bernie ecclestone like michael masi hes told stampoutracisminf westandwithlewis","negative"
"Kaduna, Nigeria","10.51,7.42","2022-04-13 21:04:46+00:00","False","0","0","4","0","shows clearly king sir lewis hamilton indeed doubt greatest time","positive"
"","","2022-04-20 20:19:14+00:00","False","0","1","0","0","rival fans saying george russell washed respecting sir lewis hamilton funnier yall worried stuff doesnt concern","negative"
"","","2022-04-20 20:16:40+00:00","False","0","0","0","0","also calling lewis hamilton fans lulu fans proves point people still going last year name calling still stopped","negative"
"","","2022-04-20 20:15:06+00:00","False","0","0","0","0","topps chrome formula lewis hamilton refractor rookie rc thehobby","neutral"
"","","2022-04-20 20:15:05+00:00","False","0","0","0","0","lewis hamilton greatest driver time wet conditions greatest driver time overall","positive"
"","","2022-04-20 20:15:00+00:00","False","1","2","5","0","lewis hamilton going take well ","negative"
"","","2022-04-20 20:13:11+00:00","False","0","2","2","0","lewis hamilton max verstappen sebastian vettel fernando alonso esteban ocon lance stroll","neutral"
"","","2022-04-20 20:05:51+00:00","False","0","0","0","0","never championship given beat hamilton sore wants needs beat never good vettel hamilton","negative"
"","","2022-04-20 20:00:02+00:00","False","0","0","0","0","george russells incredible qualifying display silverstone mclarens mesmerising monza victory lewis hamilton astonishing display paulo fsprint left great memories lets hope similar imolagp","positive"
"","","2022-04-20 20:00:00+00:00","False","72","34","664","31","im going go trying leader team im going greatest time whos years george russell pays respect team mate lewis hamilton","neutral"
"","","2022-04-20 19:59:52+00:00","False","0","0","0","0","see lewis hamiltons","neutral"
"","","2022-04-20 19:55:03+00:00","False","0","0","0","0","topps chrome formula sapphire lewis hamilton racers rookie rc thehobby","neutral"
"","","2022-04-20 19:51:17+00:00","False","0","0","1","0","lewis hamilton sebastian vettel max verstappen charles leclerc fernando alonso correct answer","neutral"
"","","2022-04-20 19:50:08+00:00","False","0","0","0","0","lewis hamilton nate diaz venus williams tom brady colin kaepernick absolute leaders field still wimpy woke","neutral"
"","","2022-04-20 19:49:57+00:00","False","0","0","0","0","cant win lewis hamilton","neutral"
"","","2022-04-20 19:49:09+00:00","False","0","0","0","0","lewis hamilton max verstappenthe rest","neutral"
"","","2022-04-20 19:46:48+00:00","False","0","1","3","0","yes lewis hamilton clearly currently one best wet","positive"
"","","2022-04-20 19:45:50+00:00","False","0","1","1","0","monster proving best tasting energy drink  lewis hamilton flavored","negative"
"","","2022-04-20 19:45:47+00:00","False","0","0","1","0","lewis hamiltonrest irrelevant","neutral"
"","","2022-04-20 19:42:25+00:00","False","1","0","5","0","st  lando norrisnd  george russelrd  max verstappenth  lewis hamiltonth  carlos sainz","neutral"
"","","2022-04-20 19:35:33+00:00","False","0","0","0","0","hmmmm knowing darling hamazingly phenomenal champson sir lewis hamilton persona im inclined believe hell stay mercedes retire reason theyve come far together hes integral part wonderful development car date","positive"
"","","2022-04-20 19:29:02+00:00","False","0","1","3","0","lewis hamilton dont post corny shit challenge impossible","negative"
"","","2022-04-20 19:27:24+00:00","False","0","0","0","0","polite reminder lewis hamilton fan still going shit really seek professional help","negative"
"","","2022-04-20 19:22:19+00:00","False","0","0","0","0","sir lewis hamilton love","positive"
"","","2022-04-20 19:21:43+00:00","False","0","0","0","0","happy birthday global inspiration may god grant life love prosperity may grant opportunity experience lewis hamilton winning th beyond hope enjoy special day balloons made rain","positive"
"","","2022-04-20 19:17:34+00:00","False","3","2","9","1","cant wait psl season end everyday nywe nywe lukaku jiki jiki nywe nywe lewis hamilton","positive"
"","","2022-04-20 19:16:47+00:00","False","0","0","0","0","lewis hamilton im fan today birthday live tijuana id excited came give surprise ask house cry sucios mexicanos de mierda spanish means jim live hope see soon greetings","positive"
"","","2022-04-20 19:11:31+00:00","False","0","1","7","0","pilgrimage devotee racing godswe saw beautiful drive lewis hamilton riding manipulation challenge","positive"
"","","2022-04-20 18:57:37+00:00","False","1","1","2","0","michael schumacher always goat lewis hamilton goat based statistics easy ramp alone track best car ever years rest grid pedal bikes","positive"
"","","2022-04-20 18:56:20+00:00","False","0","10","20","0","speak everyone community say lewis hamilton greatest driver time","positive"
"","","2022-04-20 18:56:16+00:00","False","0","0","1","0","know mean","positive"
"","","2022-04-20 18:55:34+00:00","False","0","0","1","0","sure  let mv win legal wdc first means win without extra help except teammate got talent got hysterical saw sir lewis hamilton dries opportunities season preferably fair decent way","positive"
"","","2022-04-20 18:52:30+00:00","False","0","0","0","0","girls really love lewis hamilton","positive"
"","","2022-04-20 18:51:00+00:00","False","0","0","0","0","gorgeous gorgeous gorgeous girls love support lewis hamilton","positive"
"","","2022-04-20 18:42:27+00:00","False","0","1","0","0","alright non kpop lewis hamilton time world champion formula driver lets see magic grannyyyy","positive"
"","","2022-04-20 18:41:54+00:00","False","1","1","2","0","thats lewis hamilton one zonda lh thinkone manual made stopped manuals lewis","neutral"
"","","2022-04-20 18:38:19+00:00","False","6","4","61","0","lewis hamilton goated invincible day robbed","neutral"
"","","2022-04-20 18:37:18+00:00","False","4","2","43","0","former driver current race steward derek warwick sayslewis hamiltonis still top game soon hes got chance winning step another level teamlh emiliaromagnagp","positive"
"","","2022-04-20 18:36:15+00:00","False","0","1","1","0","youre blaming hamilton crash didnt cause maxs reckless driving funny didnt even mention monza lewis gonna end podium maxs purposely crashed maxs race due messed pit stop","negative"
"","","2022-04-20 18:30:01+00:00","False","0","1","31","0","verstappens mediocre performance season far fair say hell never win legitimate championship fighting lewis hamilton title really took toll","negative"
"","","2022-04-20 18:27:18+00:00","False","0","0","0","0","tweet quoted article essentially sports","neutral"
"","","2022-04-20 18:25:03+00:00","False","0","0","0","0","psa topps chrome formula one lewis hamilton base thehobby","neutral"
"","","2022-04-20 18:20:54+00:00","False","0","0","0","0","topps chrome formula refract thehobby","neutral"
"","","2022-04-20 18:18:25+00:00","False","0","0","0","0","complete utter ad slink back oblivion never allowed near anracetrack ever know nerve talk lewis hamilton supported decision gift title humanerrorchampion","negative"
"","","2022-04-20 18:16:13+00:00","False","0","0","2","0","way get notice mentioning sir lewis hamiltonhm want know think  go away","negative"
"","","2022-04-20 18:16:08+00:00","False","0","0","0","0","average ford fiesta driver plays better game lewis hamilton item special colours costs gambled loot boxes","positive"
"","","2022-04-20 18:14:19+00:00","False","16","4","140","0","lewis hamilton faced world champions beaten one beat rookie seasonthis true champion like","positive"
"","","2022-04-20 18:13:50+00:00","False","0","0","0","0","lewis hamilton driving truck car winning race hope clear","negative"
"","","2022-04-20 18:13:48+00:00","False","0","0","0","0","polite reminder nobody gives fuck anymore even lewis lewis  ahh  sorry sir lewis hamilton dick riders stop crying ","negative"
"","","2022-04-20 18:12:48+00:00","False","0","0","0","0","sir lewis hamiltonwhat amazing role model many ways","positive"
"","","2022-04-20 18:12:29+00:00","False","0","0","3","0","still proud partnering oppo tournament sponsor still actively trading russia surely funds regime players expressed opposition happening hey cash king lewis hamilton would say","neutral"
"","","2022-04-20 18:10:04+00:00","False","0","0","0","0","topps chrome lewis hamilton silver refractor mercedes formula one thehobby","neutral"
"","","2022-04-20 18:08:36+00:00","False","0","0","0","0","charles leclerc could easily beat max verstappen lewis hamilton heir","positive"
"","","2022-04-20 18:06:54+00:00","True","0","0","0","0","lewis hamilton spoiled driving perfect cars mercedes star strugglesthe irritating person world","negative"
"","","2022-04-20 18:03:03+00:00","False","0","1","0","0","mercedes deliberately sabotaged hamiltons car garage gift rosberg championship masi always gonna find way cheat lewis abu dhabi prevent number","negative"
"","","2022-04-20 18:00:50+00:00","False","0","0","0","0","one pure storages core values shared lewis hamilton reliability drivenbydata","positive"
"","","2022-04-20 18:00:05+00:00","False","0","0","0","0","lewis hamilton topps formula new record laps history thehobby","neutral"
"","","2022-04-20 17:59:06+00:00","False","10","11","73","4","red bull advisor dr helmut marko agrees days older drivers slowly passing addslewis hamiltonisstill top game teamlh emiliaromagnagp","positive"
"","","2022-04-20 17:51:11+00:00","False","0","0","0","0","purestorage one pure storages core values shared lewis hamilton reliability drivenbydata","neutral"
"","","2022-04-20 17:50:05+00:00","False","0","0","0","0","topps chrome formula one lewis hamilton psa refractor lot thehobby","neutral"
"","","2022-04-20 17:48:16+00:00","False","0","0","0","0","source","neutral"
"","","2022-04-20 17:47:10+00:00","False","0","0","4","0","congratulations david  abeg leave  ekuke journalists  lewis hamilton profession nigeria one comes close  absolutely one","positive"
"","","2022-04-20 17:44:02+00:00","False","0","0","1","0","feeling like lewis hamilton instagram stories","neutral"
"","","2022-04-20 17:41:56+00:00","False","0","0","0","0","quite growth right congrats hope keep going strong future ps really really feel blessed afraid use blessed lemme tell ya even lewis hamilton would approve blessed moment","positive"
"","","2022-04-20 17:39:40+00:00","False","0","0","1","0","well done sir lewis hamilton","positive"
"","","2022-04-20 17:38:12+00:00","False","0","1","1","0","lewis hamilton brazil gp best racing performance time","positive"
"","","2022-04-20 17:35:03+00:00","False","0","0","2","0","everyone loves winner thats world ayrton senna one greatest winners sport ever lewis hamilton formula lewishamilton","positive"
"","","2022-04-20 17:32:26+00:00","False","0","0","2","0","much lewis hamilton content tl algorithms trying tell weekends race","neutral"
"","","2022-04-20 17:32:17+00:00","False","0","0","2","0","praying rain imola lewis hamilton get first win season","positive"
"","","2022-04-20 17:30:05+00:00","False","1","2","13","0","nico rosberg talking lewis hamiltons th wdc prior us grand prix german  lewis win th title thats totally crazy go karting best friends travelled greece holidays sat dinner said","positive"
"","","2022-04-20 17:28:17+00:00","False","0","1","0","0","hamilton caused monza forced max either go crash exactly lewis fans hate max funny lewis ok","negative"
"","","2022-04-20 17:26:52+00:00","False","0","1","0","0","maybe notice tried brasil hamilton still gained fans result know max drove car illegal wings st races lewis got dsq negligible discrepancy caused damage","neutral"
"","","2022-04-20 17:25:21+00:00","False","0","0","0","0","topps chrome formula whodoyoucollect","neutral"
"","","2022-04-20 17:25:05+00:00","False","0","0","0","0","lewis hamilton topps turbo attax formula sgc thehobby","neutral"
"","","2022-04-20 17:22:31+00:00","False","0","9","2","5","eh sir lewis hamiltons girlfriend peng yhooo","positive"
"","","2022-04-20 17:14:26+00:00","False","0","0","0","0","topps chrome formula lew sportscards","neutral"
"","","2022-04-20 17:13:44+00:00","False","0","0","0","0","australian grand prix lewis hamilton enjoy driving new mercedes","negative"
"","","2022-04-20 17:10:01+00:00","False","0","0","0","0","lewis hamilton goat titles best cheated fia call human error idiots think past best shut jealous","negative"
"","","2022-04-20 17:01:01+00:00","False","0","0","0","0","lewis hamilton backed neat food co expands new senior hires taking alternativeprotein products usmarket","neutral"
"","","2022-04-20 17:00:42+00:00","False","0","1","2","0","outraced lewis una give lewis turkey china hamilton easily outperforming alonso puncture mclaren amazing strategy hamiltonsince max slower car even newey said faster car average","neutral"
"","","2022-04-20 17:00:08+00:00","False","0","0","0","0","lot topps formula racing industry conference lewis hamilton thehobby","neutral"
"","","2022-04-20 16:49:59+00:00","False","0","0","2","0","lewis hamilton without braids favourite lewis hamilton","positive"
"","","2022-04-20 16:48:35+00:00","False","0","0","3","0","gorgeous gorgeous girls support sebastian vettel lewis hamilton","positive"
"","","2022-04-20 16:47:41+00:00","False","0","0","0","0","playing mortal kombat friend picked fighter lewis hamilton voice say finish fatality confused understood game let finish already finished","neutral"
"","","2022-04-20 16:43:32+00:00","False","0","0","0","0","analisados cbs kaiir elam floridaahmad gardner cincinnatiderek stingley jr lsuandrew booth jr clemsontrent mcduffie washingtonroger mccreary auburnsafeties kyle hamilton notre damedaxton hill michigan jaquan brisker penn statelewis cine georgia","neutral"
"","","2022-04-20 16:43:04+00:00","False","0","0","0","0","dont taken lewis hamilton names single driver terrified mercedes","neutral"
"","","2022-04-20 16:42:04+00:00","False","0","0","0","0","featured art day lewis hamilton helmet buy","neutral"
"","","2022-04-20 16:41:24+00:00","False","0","0","0","0","good morning lewis hamilton","positive"
"","","2022-04-20 16:41:00+00:00","False","0","0","2","0","lewis hamiltons former mclaren teammate heikki kovalainen lewis knew good one would thought would break michaels schumacher records hes determined wants something gives everything achieve itthoughts","neutral"
"","","2022-04-20 16:39:55+00:00","False","0","0","1","0","lewis hamilton discloses copes difficulties dyslexia abilitynotdisability","neutral"
"","","2022-04-20 16:38:38+00:00","False","0","0","0","0","que isso lewis hamilton","neutral"
"","","2022-04-20 16:38:01+00:00","False","0","0","1","0","lewis hamilton quotingsong light maybe knows sucha cutie","positive"
"","","2022-04-20 16:35:31+00:00","False","0","1","1","0","thats amazing man great job next lewis hamilton","positive"
"","","2022-04-20 16:35:05+00:00","False","0","0","0","0","topps formula lewis hamilton card lot mercedesamg goat thehobby","neutral"
"","","2022-04-20 16:33:52+00:00","False","0","0","2","0","maxs move lap lewis spain way better hamiltons overtake regain lead","positive"
"","","2022-04-20 16:29:11+00:00","False","1","0","3","0","dont afraid step light gotta step daylight let golewis hamilton swiftie sim","neutral"
"","","2022-04-20 16:29:04+00:00","False","0","1","0","0","well yeah mean started attacking said one thing lewis hamilton definitely targeting anti lewis fans arent thought done anyway youre biggest one anyway might retire","negative"
"","","2022-04-20 16:18:20+00:00","False","0","0","2","0","australia russell fight perez told let pass dont take risks  prefer take points cant imagine max wld able understand depth team order max wld hv said fo went dnf","negative"
"","","2022-04-20 16:17:55+00:00","False","0","1","0","0","dkm lewis hamilton happy know","positive"
"","","2022-04-20 16:15:07+00:00","False","0","0","0","0","topps formula one lewis hamilton checker flag version card flagship thehobby","neutral"
"","","2022-04-20 16:13:08+00:00","False","0","1","0","0","proof lewis complained nico toptier asking bottas signed proof actually brain proof talking neutral perspective proof respecting hamilton proof using logic","neutral"
"","","2022-04-20 16:12:00+00:00","False","0","0","3","0","duality sir lewis hamilton","neutral"
"","","2022-04-20 16:10:06+00:00","False","0","1","2","0","thinking lewis hamilton","neutral"
"","","2022-04-20 16:08:35+00:00","False","3","0","8","0","everyone lewis hamilton fan even say theyre lewis hamilton fans","neutral"
"","","2022-04-20 16:07:59+00:00","False","0","0","0","0","sir lewis hamiltons overtaking masterclass","positive"
"","","2022-04-20 16:01:42+00:00","False","0","0","0","0","hamiltons rt rest field lewis typically gets decent starts max seems looking around scenery lights go good starter","negative"
"","","2022-04-20 15:59:00+00:00","False","0","0","2","0","son lewis hamilton successful person bussinesses","positive"
"","","2022-04-20 15:56:09+00:00","False","0","0","4","0","lewis hamilton greatest time","positive"
"","","2022-04-20 15:53:50+00:00","False","2","0","2","0","lewis hamilton edit hes best","positive"
"","","2022-04-20 15:47:40+00:00","False","0","1","0","0","cannot put lewis hamilton series racing car expect perform win race todays context point aged fleet cannot salvaged technical prowess engineer need paradigm shift eskom new culture systems","negative"
"","","2022-04-20 15:46:00+00:00","False","0","0","0","0","absolute scenes pair prime icon schumacher prime lewis hamilton","positive"
"","","2022-04-20 15:42:02+00:00","False","0","1","1","0","absolute scenes create allbritish lineup win overpowered inform lewis hamilton prime icon moments jenson button","neutral"
"","","2022-04-20 15:38:20+00:00","False","0","1","2","0","im going honest hamilton fell tremendously ive fan weeks honestly hit anymore think everyone agree say miss old lewis","negative"
