"place","coords","created_at","possibly_sensitive","retweet_count","reply_count","like_count","quote_count","text","sentiment"
"","","2022-04-18 08:27:04+00:00","False","0","0","0","0","lewis hamilton suffering mercedes partner george russell due spoiled","negative"
"","","2022-04-18 08:23:58+00:00","False","2","0","2","0","lewis hamilton suffering mercedes partner george russell due spoiled","negative"
"","","2022-04-18 08:21:02+00:00","False","0","0","0","0","sir title sir mr lewis hamilton sir lewis hamilton","neutral"
"","","2022-04-18 08:11:57+00:00","False","0","0","0","0","news live mercedes enormous work sulking lewis hamiltonscar","neutral"
"","","2022-04-18 08:11:17+00:00","False","0","1","3","0","bts bigger kpop way sir lewis hamilton bigger true definition icons","positive"
"","","2022-04-18 08:10:57+00:00","False","0","0","0","0","confirmed lewis hamilton want make strategy","neutral"
"","","2022-04-18 08:03:34+00:00","False","0","0","0","0","lewis hamilton topps chrome fo thehobby","neutral"
"","","2022-04-18 07:55:58+00:00","False","0","0","0","0","would love see lewis hamilton race south africa","positive"
"","","2022-04-18 07:53:59+00:00","False","0","0","0","0","topps chrome formula whodoyoucollect","neutral"
"","","2022-04-18 07:53:37+00:00","False","0","3","8","0","got something almost opposite yesterday british support lewis hamilton must racist support norris russell albon half british either support coulthard mansell button etc either support ferrari thats","negative"
"","","2022-04-18 07:51:25+00:00","False","0","0","0","0","lewis hamilton poetry motion","positive"
"","","2022-04-18 07:47:47+00:00","False","0","0","0","0","thats pre prime peak lewis max would slaughter hamilton way worse","negative"
"","","2022-04-18 07:47:38+00:00","False","3","10","18","4","sulking lewis hamilton may thinking switching teams claims mika hakkinen","neutral"
"","","2022-04-18 07:41:05+00:00","False","0","0","0","0","lewis hamilton porscheaudi arrival think great were going get new manufacturers within sport especially see lot teams potential top teams customer teamsagreed lewishamilton","positive"
"","","2022-04-18 07:40:26+00:00","False","0","0","0","0","whos franz tost lewis hamilton","neutral"
"","","2022-04-18 07:40:10+00:00","False","0","0","1","0","great ali time greatest man followed sir lewis hamilton stories tell greatgrand kids someday","positive"
"","","2022-04-18 07:31:33+00:00","False","0","0","0","0","one really want see south africa says lewis hamilton next race additionnews","neutral"
"","","2022-04-18 07:31:22+00:00","False","0","0","0","0","brazilian sprint race master class weekend racing lewis hamilton showing us master class racing cant touch","positive"
"","","2022-04-18 07:24:40+00:00","False","0","1","1","0","hope youre ok unfortunately idiots access powerful cars straight passing test think theyre good lewis hamilton thought others late stay safe","negative"
"","","2022-04-18 07:05:08+00:00","False","0","0","0","0","monaco grand prix sebastian vettel lewis hamilton kimi raikkonen d daniel ricciardo","neutral"
"","","2022-04-18 07:03:41+00:00","False","0","0","0","0","lewis hamiltonspoiled perfect cars struggles withporpoising","negative"
"","","2022-04-18 07:00:32+00:00","False","0","0","0","0","need accepted proud im trying lewis hamilton","positive"
"","","2022-04-18 06:46:57+00:00","False","0","0","3","0","genuinely think season started performing hamilton though would gotten preferential treatment instead thoughlewis mercedes relationship wasnt good abu dhabi anyway chance stamp authority","neutral"
"","","2022-04-18 06:46:52+00:00","False","1","0","1","0","trooperyour movethe one really want see south africa says lewis hamilton next race addition wheels","positive"
"","","2022-04-18 06:43:09+00:00","False","15","9","444","2","onthisday shanghai mclarenites could reflect job well done jenson button chinesegp ahead teammate lewis hamilton jenson led drivers championship points mclaren led constructors championship points","positive"
"","","2022-04-18 06:41:53+00:00","False","0","2","13","0","lewis hamilton south african fans includedyou probably say spent time talking white south africansmost dutch ancestors like maxferrari huge part brand surprise","neutral"
"","","2022-04-18 06:40:40+00:00","False","0","0","0","0","lewis hamilton one watch happy car love result","positive"
"","","2022-04-18 06:40:21+00:00","False","0","0","0","0","lewis hamilton babnelson mandela","neutral"
"","","2022-04-18 06:39:30+00:00","False","21","1","175","3","lewis hamilton always saying need hear","positive"
"","","2022-04-18 06:35:25+00:00","False","0","0","0","0","cute determined sending nahylpositivity lots luck fun karting remember sir lewis hamilton also loves andbrings fun","positive"
"","","2022-04-18 06:30:52+00:00","False","0","0","0","0","bullsh man stop itlewis hamilton faces ruthless criticism amidst growing fstruggles","negative"
"","","2022-04-18 06:28:47+00:00","False","0","0","0","0","mfs like someone says like max person asks hate lewis hamilton disgusting moron vice versa lmao like respect","negative"
"","","2022-04-18 06:26:16+00:00","False","0","0","0","0","lewis hamilton supports porsche even though mercedes ferrari afraid red bulls plans sports","neutral"
"","","2022-04-18 06:26:04+00:00","False","0","0","0","0","sports three teams lewis hamilton could join sulking star pondering mercedes exit","neutral"
"","","2022-04-18 06:20:33+00:00","False","0","2","0","0","dont like sharing articles like kind interesting discussion got thinking something else strap","positive"
"","","2022-04-18 06:18:37+00:00","False","0","0","0","0","topps chrome formula thehobby","neutral"
"","","2022-04-18 06:15:31+00:00","False","0","0","0","0","one guy gets someone tell lewis hamilton salute","positive"
"","","2022-04-18 06:14:10+00:00","False","0","1","8","0","problem ad want sir lewis hamilton reclaim wdcmercedes less dominant car start season driving helped get wcc proven team player team support","positive"
"","","2022-04-18 06:03:29+00:00","False","0","0","0","0","feb lewis hamilton best","positive"
"","","2022-04-18 05:50:38+00:00","False","0","0","0","0","believe auction bench lewis hamilton sat kept prints hisbutt","neutral"
"","","2022-04-18 05:42:49+00:00","False","0","0","0","0","surer hamilton spoiled perfect cars","negative"
"","","2022-04-18 05:41:34+00:00","False","0","1","5","0","expected less lewis hamilton pfp account idiot","negative"
"","","2022-04-18 05:34:48+00:00","False","0","0","0","0","watch lewis hamiltons ludicrous collision demanding streets monacogp","neutral"
"","","2022-04-18 05:25:01+00:00","False","1","0","16","0","good morning wdc sir lewis hamilton","positive"
"","","2022-04-18 05:12:55+00:00","False","0","0","6","1","one really want see south africa says lewis hamilton next race addition","neutral"
"","","2022-04-18 05:11:06+00:00","False","0","0","4","0","speed lewis hamilton","positive"
"","","2022-04-18 04:54:43+00:00","False","0","0","0","0","one asked sir lewis hamiltons fan could russell norris fan careless leave one please","negative"
"","","2022-04-18 04:41:10+00:00","False","11","1","84","0","race week lewis hamilton race week","positive"
"","","2022-04-18 04:20:29+00:00","False","2","0","1","0","hii new twitter like carlos sainz lewis hamilton sebastian vettel favourite teamsare mercedese ferrari retweet like comment mutualsthank forzaferrari lewishamilton carlossainz mercedesamgf","positive"
"","","2022-04-18 04:18:58+00:00","False","1","0","0","0","time world champion mikka hakkinen fucking racist jealous","negative"
"","","2022-04-18 04:17:37+00:00","False","0","0","9","0","lewis hamilton world champion way grand prix winner","neutral"
"","","2022-04-18 04:13:51+00:00","False","0","1","0","0","knowbroke brain read twice realised rev talking lewis hamilton","negative"
"","","2022-04-18 04:11:46+00:00","False","0","2","1","0","youre arguing someone says lewis hamilton washed rather ironically case says contact race craft","negative"
"","","2022-04-18 03:58:26+00:00","False","0","0","0","0","bro terrible frl football barcelonanba spursnfl bengals brah istg gonna try car racin lewis hamilton automatically gets cheated","negative"
"","","2022-04-18 03:25:29+00:00","True","0","0","0","0","cant stop loving guy lewis hamilton reiterates important wish bosses year wait","positive"
"","","2022-04-18 03:13:55+00:00","False","0","0","1","0","ah yes black people enjoy lewis hamilton","negative"
"","","2022-04-18 02:56:25+00:00","False","0","0","1","0","surprising number hamilton fans least twitter seem unable distinguish enjoying car racing fighting racial justice hoping lewis wins race doesnt make mlk rooting max doesnt make afd get","negative"
"","","2022-04-18 02:46:26+00:00","False","0","0","0","0","mean hate definitely best drivers grid max verstappen lewis hamilton lewis also replaceable charles","positive"
"","","2022-04-18 02:41:00+00:00","False","1","0","11","0","otd max verstappen emilia romagna grand prix lewis hamilton lando norris hamilton norris podium marked first time two british drivers shared podium since hamilton jenson button china","positive"
"","","2022-04-18 02:33:00+00:00","False","1","1","18","0","otd jenson button chinese grand prix lewis hamilton nico rosberg vitaly petrov scored first points th button two first four races mclaren making mclaren driver accomplish feat","neutral"
"","","2022-04-18 02:31:31+00:00","False","0","0","0","0","early verstappen overaggressive reckless became much complete driver early verstappens edgy tactics quite similar early career tactics man named lewis hamilton","neutral"
"","","2022-04-18 02:12:14+00:00","False","0","3","5","0","converting thread lewis hamilton","neutral"
"","","2022-04-18 02:09:51+00:00","False","0","0","0","0","pierre gasly lewis hamilton favourite gasly easier","positive"
"","","2022-04-18 02:00:02+00:00","False","0","0","0","0","take look discuss finish higher world drivers championship lewis hamilton george russell following impressive start latter mercedes","positive"
"","","2022-04-18 01:59:56+00:00","False","0","0","5","0","hope one day somebody big enough balls documentary earlymid downfall mclaren get lewis hamilton fernando alonso jenson button kevin magnussen tellall interviews awful really","negative"
"","","2022-04-18 01:59:42+00:00","False","0","0","0","0","driver lewis hamilton another one plant based diet","neutral"
"","","2022-04-18 01:58:05+00:00","False","0","0","4","0","one gives shit name lewis hamilton majesty prince sir lewis","negative"
"","","2022-04-18 01:57:13+00:00","False","0","0","0","0","lewis hamilton damn good bruh damn","positive"
"","","2022-04-18 01:34:20+00:00","False","0","1","0","0","bad luck awesome description destroying hamilton pits immediately safety car comes twice nice argument like dont take account recovery definitely placed situationthe difference lewis impressive right","negative"
"","","2022-04-18 01:31:41+00:00","False","0","0","1","0","im big aryton senna fan cool congratulations lewis hamilton","positive"
"","","2022-04-18 01:16:07+00:00","False","0","0","1","0","lewis hamilton fan parenting done right","positive"
"","","2022-04-18 01:14:51+00:00","False","0","0","0","0","every episode nutshell red bull drama couple bits lower teams lewis hamilton insert name grande prix world championship gotten back sport tho ill give","positive"
"","","2022-04-18 01:07:24+00:00","False","0","0","3","0","sir lewis hamilton drop rn ive waited long enough","negative"
"","","2022-04-18 00:53:28+00:00","False","0","0","2","0","lewis hamiltons fit king shit","negative"
"","","2022-04-18 00:50:55+00:00","False","0","0","1","0","lewis hamilton born racer still lot things ways things done world mother comes helped even attracted father mothers husband struggles way much senselessness","negative"
"","","2022-04-18 00:38:41+00:00","False","0","0","1","0","dont trust people dont like lewis hamilton","negative"
"","","2022-04-18 00:26:34+00:00","False","0","1","0","0","need stop googling drivers worked correctly exactly beautiful sexy son lewis hamilton happen useless petulant son max verstappen","negative"
"","","2022-04-18 00:21:14+00:00","False","0","0","0","0","lewis hamilton dumb fine","negative"
"","","2022-04-18 00:16:37+00:00","False","0","0","0","0","topps chrome lewis hami whodoyoucollect","neutral"
"","","2022-04-18 00:16:17+00:00","False","0","1","1","0","lewis hamiltoncaralho fml","negative"
"","","2022-04-18 00:07:28+00:00","False","0","0","0","0","lewis hamilton big celebrities coming online defend palestine spread awareness","positive"
"","","2022-04-18 00:03:15+00:00","False","0","1","0","0","nothing worse lewis hamilton fans weird","negative"
"","","2022-04-17 23:58:39+00:00","False","0","0","1","0","lewis hamilton fans biggest toxic pos internet worse conor mcgregor fans point imagine scummy","negative"
"","","2022-04-17 23:53:34+00:00","False","1","0","1","0","time lap record  valtteri bottas race lap record  lewis hamilton imolagp","neutral"
"","","2022-04-17 23:40:43+00:00","False","0","0","0","0","grew watching dad since forever lewis hamilton michael schumacher senna","neutral"
"","","2022-04-17 23:33:12+00:00","False","0","0","0","0","inside mercedes car troubles lewis hamilton cannot win world title season","negative"
"","","2022-04-17 23:31:11+00:00","False","0","0","0","0","dont think black man like lewis hamilton lol","neutral"
"","","2022-04-17 23:29:07+00:00","False","0","1","8","0","hamilton insane wet make mistakes occasion yes human last year impatient admitted makes lot less mistakes bet person take spin wet would lewis","neutral"
"","","2022-04-17 23:21:06+00:00","False","0","0","2","1","discovered lewis hamilton made song xtina really good","positive"
"","","2022-04-17 23:16:19+00:00","False","0","0","2","0","crazy im lewis hamilton fan brutally honest ive got eyes even see max supreme sure fans look race season see something totally different someone else whos watching exact thing","negative"
"","","2022-04-17 23:10:22+00:00","False","0","0","0","0","abu dhabi watch corrupt hideous theft world title team mate lewis hamilton michael masi never forgiven","negative"
"","","2022-04-17 22:43:00+00:00","False","2","1","3","2","lewis hamilton sulking whinging could thinking switching teams","neutral"
"","","2022-04-17 22:33:54+00:00","False","0","0","0","0","sir lewis carl davidson hamilton mbe honfreng istaxi driver","positive"
"","","2022-04-17 22:29:35+00:00","False","0","0","3","0","last season best lewis hamilton performance ever see getting everything car never giving title fight incredible im saying someone never fan hamilton brad lewishamilton mercedesamgf formulaone","positive"
"","","2022-04-17 22:22:46+00:00","False","0","0","0","0","well hear still say publicity stunt believed mihlali lewis hamilton dating likebut confirmed interview year publicityand eat upjust way were eating","negative"
"","","2022-04-17 22:18:07+00:00","False","0","0","1","0","sir lewis hamilton thank","positive"
"","","2022-04-17 22:18:05+00:00","False","0","1","4","0","lewis hamilton gryffindor courage nerve stubborn passionate","positive"
"","","2022-04-17 22:10:43+00:00","False","0","0","0","0","mine goat lewis hamilton","neutral"
"","","2022-04-17 22:09:34+00:00","False","0","0","0","0","autosport awards mclaren lewis hamilton jenson button ltd signed carebay","neutral"
"","","2022-04-17 22:01:36+00:00","False","1","2","3","0","sir lewis hamilton eight time world champion","positive"
"","","2022-04-17 22:01:12+00:00","False","0","0","0","0","right us international fans see supporting hamilton racial cause stupidas lewis proud brit shaming person support driver race ridiculous","negative"
"","","2022-04-17 22:00:25+00:00","False","0","1","1","0","sir lewis hamilton eight time world champion","positive"
"","","2022-04-17 21:55:24+00:00","False","0","0","1","0","never learn wecelebrities know gullable know right buttons push remember mihlali made country believe lewis hamilton took picture went crazy ever going learn strategies aii","negative"
"","","2022-04-17 21:54:45+00:00","False","0","0","0","0","please elections lewis hamiltons love mandela might used campaign elections ruling party","negative"
"","","2022-04-17 21:53:46+00:00","False","0","0","0","0"," theyre still togethercelebrities know gullable know right buttons push remember mihlali made country believe lewis hamilton took picture went crazy ever going learn strategies aii","negative"
"","","2022-04-17 21:51:21+00:00","False","0","1","0","0","tyre failure definitely red bulls fault risking seeing strolls  also hamilton crash max racing incident max came across lewis like monza like jeddah max horrible driver glorified maldonado","negative"
"","","2022-04-17 21:48:22+00:00","False","0","1","1","0","actually crazy theres vegan athletes actually top game lewis hamilton novak djokovic kyrie irving colin kaepernick derrick morgan kendrick farris","positive"
"","","2022-04-17 21:38:53+00:00","False","0","0","0","0","lewis hamilton black white black white black man know","neutral"
"","","2022-04-17 21:37:57+00:00","False","0","0","0","0","hamilton left personal reasons beyond hopping thought might better team ron dennis control freak even mandated drivers cut hair toto mercedes allowed lewis express way wanted hes better","neutral"
"","","2022-04-17 21:36:27+00:00","False","0","0","0","0","reminder lewis hamilton racist pig someone might like crash burn","negative"
"","","2022-04-17 21:34:25+00:00","False","0","0","0","0","lewis hamilton sebastian vettel daniel ricciardo","positive"
"","","2022-04-17 21:33:26+00:00","False","0","0","0","0","lewis hamilton mercults","neutral"
"","","2022-04-17 21:21:36+00:00","True","0","0","0","0","south african car hijackers hijack lewis hamiltons benz","negative"
"","","2022-04-17 21:20:30+00:00","False","0","0","1","0","lewis hamilton","neutral"
"","","2022-04-17 21:10:54+00:00","False","0","0","1","0","december mine leclerc although love lewis hamilton wouldnt mind going spin round monaco leclerc","positive"
"","","2022-04-17 21:07:20+00:00","False","0","0","0","0","spite fias clampdown drivers wearing jewellery lewis hamilton take jewellery due welded hamilton also reflected quiet decent australian grand prix saw come home fourth","neutral"
"","","2022-04-17 21:05:25+00:00","False","0","0","2","0","fan lewis hamilton see driver constantly insulted belittled matter well performs matter result achieves toxic fans willing anything minimize imprint leaves sport","negative"
"","","2022-04-17 20:59:41+00:00","False","0","0","0","0","excited get lewis hamilton lego car easter bunny spent day building car wished came withand desk","positive"
"","","2022-04-17 20:43:31+00:00","False","0","0","0","0","eh ive always loved lewis hamilton lol","positive"
"","","2022-04-17 20:32:42+00:00","False","1","0","55","0","lewis hamilton greatest time","positive"
"","","2022-04-17 20:30:21+00:00","False","0","0","0","0","lewis hamilton pic youre brother ahead next weeks british touring car championship lets hope hes successful","positive"
"","","2022-04-17 20:30:05+00:00","False","0","0","4","0","matthew mcconaughey follows lewis hamilton igking shit","neutral"
"","","2022-04-17 20:29:49+00:00","False","3","1","15","0","winter storm watch issued oneida lewis madison herkimer hamilton northern fulton otsego chenango counties mon pmtues elevation driven storm heaviest snowfall happening highest elevations snow heaviest monday night","neutral"
"","","2022-04-17 20:28:48+00:00","False","0","0","0","0","lewis hamiltonwell see","positive"
"","","2022-04-17 20:27:09+00:00","False","0","0","1","0","lewis hamilton belovedin brizal","positive"
"","","2022-04-17 20:25:47+00:00","False","0","0","0","0","flume mix volume oxford backroadslewis hamilton mode engaged","neutral"
"","","2022-04-17 20:10:42+00:00","False","0","0","7","0","one sir lewis carl davidson hamilton becomes world champion","neutral"
"","","2022-04-17 20:10:39+00:00","False","0","0","2","0","lewis hamilton beautiful beautiful man im gay","positive"
"","","2022-04-17 20:10:27+00:00","False","4","1","35","0","lets go sir lewis larbalestier hamilton cannot retire raced mzanzi sa","positive"
"","","2022-04-17 20:09:51+00:00","False","58","11","1083","4","another young karter nahyl tornado using sir lewis hamilton inspired helmetyou follow karting journey","positive"
"","","2022-04-17 20:02:49+00:00","False","1","0","0","0","hello ftwt created account share excitement interest formula improve english german make friendsmy number one pilot sir lewis hamilton formula lewishamilton maxverstappen scuderiaferrari charlesleclerc carlossainz","positive"
"","","2022-04-17 20:02:42+00:00","False","0","0","0","0","big fan lewis hamiltons dad","neutral"
"","","2022-04-17 19:51:41+00:00","False","0","1","0","0","lewis hamilton fanopinion disregarded","neutral"
"","","2022-04-17 19:49:08+00:00","False","0","0","0","0","sports lewis hamilton backs porsche despite mercedes ferraris fears red bull plan","neutral"
"","","2022-04-17 19:45:28+00:00","False","0","0","0","0","sir lewis carl davidson hamiltonmbe honfreng","positive"
"","","2022-04-17 19:37:17+00:00","False","1","0","10","0","sometimes get sad remember max verstappen th championship behind lewis hamilton","negative"
"","","2022-04-17 19:36:38+00:00","False","0","1","1","0","bro lewis hamilton naked","neutral"
"","","2022-04-17 19:26:15+00:00","False","0","0","3","0","agree lewis hamilton would like see formulaone return continent africa sincerace every continenti would lik also see diversity among race cars drivers retirewho nextin formula","positive"
"","","2022-04-17 19:22:39+00:00","False","0","0","1","0","witnessed lewis hamilton able defend inside","negative"
"","","2022-04-17 19:22:22+00:00","False","2","4","6","0","hi im new ftwt like lewis hamilton mostly everybody grid makes happy looking moots","positive"
"","","2022-04-17 19:21:17+00:00","False","0","0","0","0","brazil lewis hamilton","positive"
"","","2022-04-17 19:19:20+00:00","False","0","0","0","0","people talking shit lewis hamilton clue formula","negative"
"","","2022-04-17 19:19:15+00:00","False","0","0","0","0","starts year going recordbreaking eight world championshiphe put immense pressure verstappen red bullsir lewis hamilton nowcrosses line wins bahrain grand prixboycan host party anyday","positive"
"","","2022-04-17 19:15:06+00:00","False","0","4","11","1","lewis hamilton could thinking leaving mercedes difficult start new season claims mikka hakkinen","neutral"
"","","2022-04-17 19:11:28+00:00","False","0","0","2","0","one example teamlh invalidating opinions poc support lewis hamilton using racial slurs gaslighting","negative"
"","","2022-04-17 19:06:25+00:00","False","0","1","0","0","maybe need ur kids take care cuz seem lonely sick mind ya business im fangirling lewis hamilton bruh","negative"
"","","2022-04-17 19:05:58+00:00","False","0","1","1","0","hello name karam definitely new twt favorite drivers lewis hamilton goat thats also like everyone except mv lando nowins fernando alonslow please like retweet find new mutuals","positive"
"","","2022-04-17 19:04:33+00:00","False","7","2","95","2","hate mfs hating lewis show lewis hamilton topic cause tf would wanna see","negative"
"","","2022-04-17 19:02:49+00:00","False","0","1","1","0","lmfaooo searching word lewis hamilton spread hatred poor boomer go find caregivers nursing home","negative"
"","","2022-04-17 19:00:34+00:00","False","0","0","1","0","yes sir lewis hamilton love bring home","positive"
"","","2022-04-17 18:59:23+00:00","False","1","0","3","0","formula africa drivers champion lewis hamilton says yes could soon get racing back africa boss stefano domenicali also hinted","positive"
"","","2022-04-17 18:50:57+00:00","False","1","2","23","1","hello name new twt favorite drivers lewis hamilton goat xnda sir lewis hamilton rightful world champion also like charles george yuki gasly ocon mick lance please like retweet find new mutuals","positive"
"","","2022-04-17 18:49:07+00:00","False","0","0","0","0","well well would guessedsir lewis hamilton","neutral"
"","","2022-04-17 18:49:06+00:00","False","0","1","0","0","stop merc team lewis hamilton baaaaby","positive"
"","","2022-04-17 18:47:24+00:00","False","0","0","0","0","lewis hamilton best luck brother next weekend british touring car championships","positive"
"","","2022-04-17 18:45:47+00:00","False","0","0","0","0","lewis hamilton praises george russell","positive"
"","","2022-04-17 18:43:27+00:00","False","14","10","94","2","hello name taseen new twt favorite drivers lewis hamilton goat xnda sir lewis hamilton rightful world champion also like charles george yuki gasly ocon mick magnussen please like retweet find new mutuals","positive"
"","","2022-04-17 18:43:14+00:00","False","0","0","4","0","know refuse hide anymore favorite driver lewis hamilton hes baby boy feel shame said said","positive"
"","","2022-04-17 18:42:26+00:00","False","2","0","30","0","wishing lewis hamilton defenders best","positive"
"","","2022-04-17 18:37:25+00:00","False","0","1","0","0","protect sir lewis hamilton costs","positive"
"","","2022-04-17 18:36:02+00:00","False","7","6","16","0","weirdos happy easter day drew favorite weirdo lewis hamilton da british origins","positive"
"","","2022-04-17 18:32:04+00:00","False","0","0","1","0","mika shows us video clearly boasts taunting ayrton senna car calls analysis used jibe sir lewis hamilton ironical see mika small man instead great wdc","negative"
"","","2022-04-17 18:20:00+00:00","False","0","0","8","0","cheating pregnant rihanna crazy robbing lewis hamilton record breaking th world championship insane","negative"
"","","2022-04-17 18:15:30+00:00","False","2","1","4","0","ayrton senna michael schumacher juan manuel fangios family see lewis hamiltons greatness surely mfers see sat home may like lewis respect hes done sport","positive"
